,prof,review,rating,emotion,quality
0,https://www.ratemyprofessors.com/professor?tid=33884,"['Wonderful Professor. She makes psychology interesting and makes you want to come to class. She does a wonderful job getting everyone involved in class. She is very sweet and very funny. I recommend taking any subject she teaches. She is wonderful, just show up to class and care.', 'As a person-she was a good professor. As far as everything else goes-not so great. Constant hints of her being intoxicated DURING class and she allowed other students to smoke with her outside of class (her favorites). Her tests were very tough. She only tested with notes and the tests were all over the place. Dont take her-you will regret it!', 'An amazing professor. I enjoyed every minute of her class. She was thorough, engaging, and interesting. She sparked my interest in Psychology. Even though her tests are difficult, she gives you the tools to ace them. The overall course experience was memorable, in a positive way.', ""Best professor I've had at King's. Her tests are very difficult, but the material is extremely interesting and actually applicable to real life. In most classes, I'm daydreaming more often than not, but in her's my attention is held from beginning to end because I can't wait to learn about what exciting concept we are going to discuss next."", 'AMAZING proff. grades are based purely on exams and they are hard but she is just soo amazing and gives really good examples in class to help you understand and remember the material. I would take her over and over if i could. definately reccomanded', 'Excellent teacher, one of the best in the department. Extremely helpful but you have to do the work and the reading to get a good grade. Tests are hard but her classes are worth taking.', 'Awesome especially for a distance learning class.  Learned a lot.  Great examples.  Do the work if you want the grade.', ""Excellent but demanding course.  Assignments very interesting to do.   Created an open class atmosphere and changed how I understand women's role and how it has changed over time."", 'No Comments', 'No Comments', 'She was nice but i felt her test were too hard for the criteria', ""She was so sweet and helpful. I loved talking to her after class, and she helped mold the class around what we were interesed in. I didn't think I'd enjoy a psych class so much."", 'HARD TESTS!!! Very fun in class and nice lady, but her tests are very very very difficult!', 'She is an EXPERT in Social psych, and personality. Her tests are almost impossible to do well on, but there is extra credit and also other assignments that can help you get a good grade. She required public speaking, I think all her classes are like that.', 'tests are extremely hard. awesome lady cuz she smokes like a chimney, but tests get harder on material that doesnt need to be so hard. overall grade could be higher if tests were clearer', 'I must be alone on this, but I thought she was a real hard @ss. Very unclear on WebCT assignments. Tests way harder than they needed to be. Overall class test scores got lower with each test.', 'She makes physcoogy clear and is fun to smoke with after class.', 'Awesome lady, especially if you smoke.']",4.2,"['awesome', 'average', 'awesome', 'awesome', 'awesome', 'awesome', 'awesome', 'awesome', 'awful', 'average', 'average', 'awesome', 'awesome', 'awesome', 'awful', 'average', 'awesome', 'awesome']","['5.0', '3.0', '5.0', '5.0', '4.5', '4.5', '5.0', '5.0', '2.5', '3.5', '3.5', '5.0', '4.5', '5.0', '2.0', '3.5', '4.0', '5.0']"
1,https://www.ratemyprofessors.com/professor?tid=34298,"['he is definitely scholarly, knows his stuff, and  respected by students. he is not obnoxious as some profs i came across just because they have a Masters or PHD. however, I think, his distribution of grades is not exactly the best. i enjoyed his lecture, even though it was a boring 2 h and a half, he manged it well with his knowledge and jokes.', ""Good prof, makes class interesting and is willing to help you, and you don't need the textbook. "", ""Francis O'Brien is the definition of a gentleman and a scholar. He knows the material very throughly and makes the class engaging and interesting! If you have the opportunity to take a class with the man I highly recommend it!   P.S. You don't need to by the book, the notes are all you need to study."", ""Francis (not Frank) O'Brien is awesome. Took Intl. Law Mon. nights 7-930, he was interesting, funny, and engaging. Has an LLM. in Intl. Law from Cambridge so he knows what he is talking about. Kept things interesting even during the long class. If you are into Law/Intl. relations and have the option of a class with him, take it! Do work, easy marks"", ""Such an amazing professor!! His class was so interesting! He is such an intelligent lawyer and knowing so much about his field of interest. His sides are very important as well as his little drawings, and he did refer to the textbook on the final exam. A lot of information to retain, but worth it if you're interested in society and law course!"", ""Just because one is charismatic does not mean one is a good professor. O'Brien is witty & knows his material, but was hard to get in touch, forces you to attend class for slideshows that he wont upload online,gives much harsher grading that don't fit with 3000 level POSC courses, and does not return a majority of marks until the day of the final."", ""BEST PROF EVER! He is so funny and makes those long classes bearable. His exams are always fair and he makes the course content super interesting. I've taken three classes with Frank and loved all of them. You Rock, O'Brien!"", 'He is a really nice professor, he makes class interesting for sure. But he is an extremely hard marker. If you want a good mark I suggest taking another political science course or for those ibba students definitely another international elective. Almost impossible to score 80 or higher. Ive heard from many people who have taken courses with him', ""Friendly guy, approachable, but an awful grader. I'm an A student and have worked hard, but I barely pulled off a B."", 'He is AMAZING. I cannot add anything more than what was already said. He is suuuper nice and hilarious and really makes the course interesting.', ""Go to class. He only uses the notes and there is no need for the book. Memorize everything in the notes because it will be on the test. Even the most obscure details. Extremely helpful. Doesn't talk down to students even though he has a Master's in Law. Great asset to the political science department."", 'good prof ... i foung him a hard marker ...espially on the paper... overall pretty good', 'Very good prof! Everyone should take a least one course with him', 'Love him!  He is the best/hottest prof at MUN!!!!', 'Go to his all his classes and take good notes, he is very clear in his lectures and encourages discussion. Three words for this professor, HOT, SMART, and HOTTTT!!', ""he's a smart man and teaches very well...his jokes are a little dry and if you can deal with the annoyance of having rnc cadets in the class (they are the most obnoxious people...they never shut up) you should take his classes...and he's extremely hot"", ""Although the course material is pretty dry, he makes the lectures as interesting as possible. He doesn't give too many notes and if you pay attention in class you will do fine. His jokes are corny, but he's so handsome! Definitely take a course with him if you can."", ""not bad, but it makes me wonder why he doesn't actually practice law?  he seems like he would make a mint practicing and probably makes peanut teaching.  why frank why"", 'He is a teacher you actually want to listen too. He makes the course fun, with a bit of sarcasm and such. EXCELLENT prof!', 'Excellent prof!! Best lectures.  May go a bit fast but is willing to repeat if necessary!  He is by far the best of the department!  Too bad he only teaches 3 courses!  What an intelligent man!  And his jokes!  Never missed a class!']",4.4,"['awesome', 'awesome', 'awesome', 'awesome', 'awesome', 'awful', 'awesome', 'average', 'awful', 'awesome', 'awesome', 'awesome', 'awesome', 'average', 'awesome', 'awesome', 'average', 'awesome', 'awesome', 'awesome']","['4.0', '5.0', '4.5', '5.0', '4.5', '2.0', '4.5', '3.5', '2.5', '4.5', '5.0', '4.0', '4.5', '3.5', '5.0', '4.0', '3.5', '4.0', '4.5', '5.0']"
2,https://www.ratemyprofessors.com/professor?tid=34325,"[""He is a pioneer in his field and I learned a lot from this class. Yes he is a hard marker, but he wants you to understand what he is teaching - if you don't understand it, you won't get the points. Simple! If you don't understand, approach him and ask for help."", 'I absolutely hated this class. He marks his exams really hard and when I felt fully prepared for the exam, I would end with a very poor mark which I felt did not reflect what, or how much I studied. I also asked in the first class to give me tips for studying for his exams and he replied ""just know your stuff"". So unhelpful! Wish I didn\'t take it.', ""He is the toughest grader I ever had. If you don't need the course and he is the professor drop it while you can."", ""LoLordo is a very intelligent man but PSYO 2140 was hard. I was in 4th year and took this class as an elective and I wish I didn't. Although he is good at explaining concepts, his test material is quite challenging and you really need to know the textbook back to front. Not an easy class so be prepared. "", ""Dr. Lolordo is a great professor; very knowledgeable and helpful! His quizzes did require more than simply remembering facts, but it wasn't hard to understand the theory. In comparison to Neuro courses, 2140 was a breeze. The class is definitely more Psych based than Neuro, but it felt like a privilege to learn from such an expert."", 'Good professor, pioneer in the field. Worked with many well-respected people, and is well-respected himself. Very intelligent person, and very easy to approach. Definitely a realist. Exams are extremely difficult though. He holds study sessions prior to the exams for anyone wanting to attend. Very old school style, which is a real treat to have.', 'Great prof! His class was hard therefore if you are planning on taking the class you need to ask yourself 1) are you interested in the material 2)are you able to write in essay format well 3) can you integrate textbook and overheads to make sense of the material.', ""Fantastic professor, fantastic guy. Seems to know everything about his subject, including names and dates and personal anecdotes about particular researchers. Cares enough about his students to continue to grade essay exams rather than going to bubble sheets and multiple choice. Also, one of the kindest people I've ever met."", 'Prof. LoLordo is a challenge and so is his class. Interesting and intelligent, a great class for someone studying Psychology, but a poor choice for an elective because of the time and effort required.', ""great prof, if you actually go to class, do the readings before/after, and pay attention the whole time, you will do well... the extra help sessions are really great too, so don't be scared to attend those too."", ""This class is definetly one of the hardest I've ever taken. The prof is AMAZING! Really take this class if you are looking for a challenge and want to find what you can accomplish... From this class I learned to challenge myself and work hard plus all the interesting experiments! I really liked the class.."", 'Yes his course was difficult. However you learn a lot and I know it got me interesting int the field of animal learning and more so into psychology. Cheers for Dr.LoLordo!', 'amazing proff.', ""If you're used to high marks, this is not the course for you. In a lot of the experiments he talks about, he was the original researcher...therefore, he marks his exams ridiculously hard. No answer is ever enough. If I had the choice to take this course over, I wouldn't!"", ""Never ever again. I mean, he seemed like a really great guy and was very helpful (GO TO THE TUTORIALS) but his marking was very tough. If you have no interest in taking this class, don't."", ""His tests actually weren't that bad, they test what you know which is much better than multiple choice. If you go to lectures and do the readings everything makes sense but read what he's goign to teach or skim over it before the lecture if you can. I learned a lot in his class, great prof"", ""This class is so incredibly boring you want to poke your own eyeballs out for something to do, you have to buy a text book from the 60's only because he is quoted all over the place in it...so boring!"", 'This class was HARD HARD HARD. The tests were worded really weird. LoLordo himself has done a lot of research, and so I felt honoured to be taught by him, however the class seems more appropriate for 3rd year.', 'Best Prof you ever had?! You must have been a first year! I cannot speak for one on one, but his tests are so hard to understand, you would swear that you were being tested on another course.', 'At first, I thought his long-answer tests were unfair in the multiple-choice world of second-year psychology.  However, I had to learn his material so well that I ended up doing a rat-based honours thesis...and asked Dr. LoLordo to supervise me.  Very helpful and accessable.']",3.7,"['awesome', 'awful', 'awful', 'average', 'awful', 'awesome', 'awesome', 'awesome', 'average', 'awesome', 'awesome', 'awesome', 'awesome', 'awful', 'awesome', 'average', 'awful', 'average', 'awful', 'awesome']","['5.0', '1.5', '2.0', '3.0', '1.0', '4.5', '4.5', '5.0', '3.0', '4.0', '5.0', '5.0', '5.0', '2.0', '4.0', '3.5', '2.0', '3.5', '2.5', '5.0']"
3,https://www.ratemyprofessors.com/professor?tid=34429,"[""Malki gives lots of self-led learning -- homework assignments to learn a chapter on your own, or a topic not covered in class, that you absolutely have to do because they will be on the tests. He's not bad, but very dry."", 'Very sweet man who actually cares about his students and wants to see everyone succeed. He offers a lot of extra credit and favors everyone who participates and gets to know him.', ""It's very difficult to get good grade in his class. He gives a lot to read and participation matters. He puts in a lot of effort too."", ""Professor Malki expects a lot from students even though this is an introductory course. If you are in the honors course, be ready to work harder than other classes. He does not have clear grading criteria and his exams are very difficult. He feels the material is very easy so he doesn't take enough time to explain anything in depth."", 'dude is a terrible professor. all he does is talk all class throwing info at you. There were no tests except the midterm and final. He makes the class unbearable.', ""He's a nice guy but does not know how to teach. He's a tough grader for everything. Good luck on the paper because he cannot explain the grading criteria for his life and you'll get a low grade even if he says its a good paper. Tests are all short answer / definitions. STUDY STUDY STUDY. His only saving grace is extra credit that's worth a lot."", ""Malki is such an amazing professor. People only complain about the class because they don't want to put work in. There IS a lot of info, but he teaches it well, and the book is there for further understanding. He gives so many extra credit opportunities and they will help you if you're struggling. Just take notes when he lectures and pay attention."", 'I enjoyed the class, but be-prepared only copy down what the slide is about and then type or write what ever comes out of his mouth DONT worry too much about the slides because it will be in your text book. I wish I knew to do that. Also participate as much as you can. He likes to jump around when he talks going from one topic to the next.', ""I absolutely loved Professor Malki! He is my favorite professor so far! He is incredibly helpful and even though his class is not easy if you show you care about your grade throughout the semester, work hard and participate you're golden."", ""Great professor but overwhelms you with a highe  amount of material that you will be responsible for on the midterm and final. Does not put anything into the gradebook. Picks favorites. It's an intro class but he makes it very hard. Gets so boring. I'd reccomend taking an easier professor. "", ""This guy was my beacon of hope freshman year. If he likes you you're golden. My advice is to smile and nod your head during his lectures. Also play biz cafe early in the semester before you start the project he'll love you. He's harsh on the group presentation but honestly it's for your best interest. Learned a lot from him. Even wrote me a rec."", 'He easily related real life topics to what we were covering in class. Bizcafe was a fun group project and was the bulk of the work for the class. I felt that I studied harder for his midtermfinal than all my exams combined and I still got a bad grade. PARTICIPATE and do EC and your grade will be cushioned from his tough grading.', 'so hard. he requires so much!!!!!', ""Very enthusiastic. Amazing teacher. I know a lot of people find him hard but personally i think thats just because they don't try at all. He's awesome. I learned so much and he inspired me to pursue an MBA "", ""Smart and sophisticated, yes you can learn a lot from him, but he's not easy. He expects you to know everything, marketing, accounting, finance etc. Avoid if you are not truly interested in business, or if you are not ready. Picks favorites, I wasn't one of them, biz cafe can be a pain, i did all the work in the group project, ended up with a B-"", ""Amazing professor! He is very nice and is always willing to help if you show the slightest of effort and interest in assignments. He curves a lot so don't worry about the midterm and final"", 'Professor Malki is the guy to take if you are serious about the Subject. He is fun and has a practical approach to the Subject.', ""Great Professor. NOT an Easy A, but if you're looking to learn principles that you can apply to your professional career in business, take this man. Extremely helpful and clear. Study for the exams and you'll be good."", ""I found this class quite helpful. He is clear with what he explains and if you are really interested in the business world, you'll find this class quite satisfactory. He is a good professor. If you don't mind some hard work and dedication, this is the class for you."", ""He's nice an all but he's bad. His lecture are boring and he gets of topic so it easy to get lost in his class.The only work you do is BizCafe and a lil paper. He only gives two exams which he never returns and he doesn't give you the grade. Lol literally watched nextflix in his class and got a B so he CURVES A LOT and i didnt even buy the book.""]",3.8,"['average', 'awesome', 'average', 'awful', 'awful', 'awful', 'awesome', 'awful', 'awesome', 'awful', 'awesome', 'average', 'awful', 'awesome', 'awful', 'awesome', 'awesome', 'awesome', 'awesome', 'average']","['3.0', '5.0', '3.0', '2.0', '1.0', '2.0', '4.5', '2.5', '4.5', '2.5', '4.5', '3.5', '1.0', '4.0', '2.5', '5.0', '5.0', '5.0', '5.0', '3.0']"
4,https://www.ratemyprofessors.com/professor?tid=34742,"[""I think he was by far the best math teacher I've taken. He is clear on what he wants and if you have any problems at all he is there to help. Great teaching style"", 'Easy A. Good teacher!', 'Worst Professor EVER!! I have a 4.0 GPA and I would come to class everyday and it was pointless, I learned more from reading my textbook than from this professor. I would show him what I did not understand, and how far I could do the problem and he was SO RUDE and just gave me the answer. No calculators allowed on quizzes or exams.', 'It could be worse. Pretty good.', 'I am his son and I do agree that he is one of the best tecahers there. He helps me with the math work when I need it most.', 'Take him in summer, NO GATEWAYS!!!! Teaches at DePaul also, and is a great professor overall']",3.7,"['awesome', 'awesome', 'awful', 'awful', 'awesome', 'awesome']","['4.0', '5.0', '1.0', '2.5', '5.0', '4.5']"
5,https://www.ratemyprofessors.com/professor?tid=35006,"['Excellent, truly one of the best.', 'I liked him very much. He is fair, and makes the module interesting', ""Great professor. Enthusiastic about what he teaches and is interesting. Gives good assignments that aren't difficult but help you understand the module."", 'pretty boring and thinks he is funny when he tells stupid jokes', ""Phenomonal! A enthusiastic and incredbile intellegent prof. His lectures are captivating. He is very clear and encourages classroom participation. If you don't take a course with this prof you are seriously missing out."", ""If I were king, this man's courses would be required to all students. It was his Darwinism class that made me switch from BA to BBA a few years back, and the ideas presented in his STS course have changed my outlook on many aspects of life. His papers may make you pull hair, but the lectures are entertaining enough to make it WELL worth your while!"", 'he was great!', 'Very nice, approachable professor. Knows his history and teaches enthusiastically - not boring! Answers any and all questions. Assignments are not difficult at all. Excellent prof who is highly recommended.', ""I was not a history kind of person, but, Steven made lectures really interesting, using excellent examples and references.  He always had answers for any questions that students would have, even the ridiculous questions from the one 'guy' that always ends up in every class.  He related all of the class material really well.  HIGHLY RECOMMENDED!"", 'He was an awesome person. Gives second chances on papers. Loves the subject he teaches and teaches well. Awesome prof!', 'good guy, knows his stuff, interesting, and has reasonable expectations. his classes usually allow for lots of choices on how your mark is determined, i highlt recommend', 'I took Hist of the Body 5 years ago, and now I am taking graduate studies at the University of Alberta.  Dr. Turner is STILL the best teacher I have ever had.  He is inspiring, interesting and so willing to help.  he really loves his job and is so friendly and approachable...TAKE THIS CLASS!', 'his nature/nurture side was pretty interesting and i liked him. he was very enthusiastic and nice.', ""Turner was pretty good. I really loved History of the Body and I was amazed to learn that he came up with it himself (and a colleague). He did an awesome job! He always encouraged discussion in the class and seemed genuinely interested. He's a fair marker too!"", ""What an awsome teacher. He's really into his stuff. Very helpful. Always stops to see if anyone has questions or comments. I'm gonna take another one of his courses."", 'Pretty decent lad, fair marker, give second chances. Interesting courses, and reading! Essay topics interesting', 'Interesting prof., good lecturer. His only fault... Hist of the Body is not a 3rd yr. class, but the readings sure are! Does not take into consideration how much effort a person puts into a paper when it is hard as hell!', ""Professor Turner is the best professor i would have to say that i have had so far, he's funny, takes interest in his students, and makes the course really interesting, before this course i was not the history type,i love it and he is an amazing teacher..."", 'Great prof who makes class interesting. Only fault I can think of is that he favours the art students. Us eng. students would be marked way harder for a very technical essay and the arts students would get grace marks for writing their name correctly.', 'he was alright, makes bland course topic somewhat interesting.']",4.5,"['awesome', 'awesome', 'awesome', 'awful', 'awesome', 'awesome', 'awesome', 'awesome', 'awesome', 'awesome', 'awesome', 'awesome', 'awesome', 'awesome', 'awesome', 'awesome', 'awesome', 'awesome', 'awesome', 'average']","['5.0', '5.0', '4.0', '1.0', '5.0', '4.5', '5.0', '5.0', '5.0', '5.0', '5.0', '5.0', '4.0', '4.5', '5.0', '5.0', '4.0', '5.0', '4.0', '3.5']"
