,prof,review,rating,emotion,quality
0,https://www.ratemyprofessors.com/professor?tid=46467,"['The class is a little boring at times, however, the tests are easy if you take notes during his lectures. Only 3 of them throughout the semester and 3 very short papers.', ""Some people say he's boring, but what do you really expect...? I liked his style of teaching. Sometimes he gets off topic. He prepares you for the tests really well. You seriously have to be stupidlazy not to pass this class. "", ""He is so boring, all he does is ramble!!! There are only 3 tests, a map quiz and a novel quiz. Take lots of notes because that's what the tests are based on. No need to buy a textbook, you'll NEVER need it. the tests are hard and not straightforward!! Don't take this class unless you really enjoy geography, because i barely passed!!"", ""This class was very very boring. he lacks clarity and goes on and on about irrelevant things. Tests are very confusing and not straight forward, sometimes didn't correspond with material presented in class. Attendance is mandatory. DO NOT TAKE THIS CLASS!"", ""Boooooring. He knows his stuff, but goes on and on and on and on. You will need to go to class and take notes to pass tests, however. Very condescending towards anyone who doesn't give him the exact answer with exact wording he wants. Also very opinionated to an infuriating degree. It's not the worst class, but you can find a much better one."", ""Do not need the book. Classes are straight forward and easy to follow. No real homework or big essays, just exams and article reviews. Real nice guy who doesn't make you feel stupid."", 'Class is extremely boring. I had no interest in taking it anyways. All his tests come from his lectures and the lectures are long and boring. However the extra credit opportunities helped, and the assignments such as map and novel quiz and when he went over the test the class before sometimes came in handy.', 'Class was extremely boring. had nooo idea what he was talking about and his tests are very confusing. Thankful for the extra credit but woudnt take a class with him again unless i had too.', ""Class is extremely boring, his lectures are dreadful, half the class would be knocked out by the first 10 mins, if you aren't very interested in the subject then this isn't the professor for you, one of my hardest Gen Eds to date"", 'This class is very boring and hard to stay awake. You must take notes from his lectures because that is what the tests are based on. Only assignments are a map quiz, novel quiz, project, and 3 tests. Do well on the tests because each test is worth 25% of your final grade in the class. Good thing is that there are extra credit opportunities.', ""The class can be pretty boring and random, but pay attention in class and you will do fine. Take notes on his rants because even though they aren't on the study guide they will show up on tests. Prof is so sweet, he really wants you to do well. SO MANY opportunities for extra credit. Take advantage of them and take good notes and you'll do fine"", ""Lectures are very boring, and no electronic devices are allowed ever. He goes off on the longest rants and examples that don't make sense. Tells you the textbook is important but never references it. It isn't worth buying. Tests are all multiple choice and matching but are very difficult to score high on. I don't recommend him."", ""Very strict on cell phone use, and SOOOO BORING.  I can barely keep my eyes open in this class. He's such a sweet old man and I feel bad but I can never pay attention.  However, he does review the test the day before so make sure you attend so you know exactly what to study."", ""His class is incredibly boring. He definitely likes to hear himself talk. Half the time, whatever he is saying isn't even relevant to the topic. He once spent the entire class period talking about wheat."", 'Pretty easy class. He reviews stuff that is on tests day before. Gives a lot of extra credit chances. Tests are based off of notes not the book. However, he is a very boring teacher, but he knows what he is talking about.', ""Positives: his lectures are what the tests are on. He reviews what will be on test in the class before test. Negatives: his lectures are boring and irrelevant most of the time. Tests are extremely hard,not everything he says is on the test so study relevant lecture notes! He is not clear on how to use the book for studying. I don't recommend him"", ""I've read these other comments and I'm not sure what people are talking about.  I've had two classes with him and didn't buy the book for either.  I got almost 100s in both classes.  All you have to do is go to his lectures.  He tells you EXACTLY what is going to be on the test during the review class beforehand."", ""Class was extremely boring. Also the stuff that was on his test wasn't the same as what he said in class. Don't take this class with him!"", ""He is ridiculous. You have no clue what's going to be on the exam because he's so vague. His study guides don't help at all. He even gave us questions on the exam that weren't discussed in class and weren't in the book.  The only good thing is he curves grades.""]",2.8,"['awesome', 'awesome', 'awful', 'awful', 'average', 'awful', 'awful', 'awful', 'awful', 'awful', 'average', 'awful', 'awesome', 'awful', 'awful', 'average', 'awful', 'awesome', 'awful', 'awful']","['5.0', '4.0', '1.5', '1.0', '3.0', '2.5', '2.5', '1.5', '1.0', '2.5', '3.0', '1.0', '5.0', '2.0', '2.0', '3.5', '2.0', '5.0', '2.0', '1.5']"
1,https://www.ratemyprofessors.com/professor?tid=46549,"['Very competent Accounting teacher, and will return whatever attitude you give her. The textbook is required as the homework is assigned through it, and there are a few things not taught in class that you may need to look up on the rare occasion. Have a mobile device ready for class as she will take attendance through online polling questions.', ""Mrs. Breen can be a tough teacher in a tough class. But she absolutely gives all the resources necessary to make a good grade. If you want to actually learn accounting and not just pass, she's the one to take. She will also round grades at the end of the semester! Would recommend."", 'Accounting is a difficult class in general but she gives outlines that she explains in class which the test and quizzes are based off of. She outlines what you need to study before the quizzes and exams. Also, she has flexible office hours and is available whenever it is needed. She is a great professor!!', ""She is a great accountant, but a bad teacher. She goes through so many slides at an alarming pace that it is very hard to keep up with and understand the material with little time for questions. The material she covers doesn't help you with the homework that you are taking hours to do. Find another teacher who doesn't go through a chapter a day."", ""So here's the deal. Accounting is the most difficult/confusing course I have taken periodt, so the professor really doesn't matter. Its gonna be hard either way. You have been warned. Besty Breen expects too much of her students. Print out notes, however, they don't follow the pre-lecture on Wiley plus. Test are hard. Just be ready to grind..."", ""SUCH as tough professor! Notes are rushed through and you're expected to be an expert on it and teach yourself before class. Tests are super hard. She constantly tells you how almost everyone fails the class which is pretty discouraging. If you have skilled accounting knowledge she is a good professor, not for beginners because she moves SO FAST"", 'Accounting is the worst class ever but shes a great teacher!! She couldnt have explained it any better!', ""Tests were super hard and there was so. much. homework. I made a 69% in her class. Fill in the blank notes, doesn't post notes on canvas, lecture heavy, & no extra credit. Taking ACCT2121 right now for Summer 1 and currently have an A. Current prof makes account fun (WHAT?!)... I wish I took my current professor instead of Prof. Breen for sure."", ""Accounting is a hard class to teach, but the pace of this class was too fast. she expected you to do way too much out of class and she gives a quiz every chapter. this is one of the hardest classes I've taken at Charlotte."", ""She is one of the best professors Ive had. I like how she gives us the lecture notes with blanks to fill in before class so we dont have to write the notes down word by word. Theres a good amount of homework but nothing excessive and a lot of the homework problems have tutorials with them. If you put in the work for this class you'll be good."", ""Breen is an excellent professor. She takes a subject that can be boring and for many, very difficult, and makes it interesting and easy to learn. She has a passion for the subject. Reviews say it's a hard class, but I think you just have to be a good student. She can come off as snippy, but she just doesn't tolerate slackers or bad students."", ""Betsy is very resourceful, she knows what she's talking about and is always willing to help. Her ACCT I class definitely feels like two classes with the difficulty of accounting, and the homework. Tests are hard so spend more time studying than usual!"", 'She expects you to fill out 10 page lecture outlines before you come to class, and as a result moves fast and does not repeat herself. She reads directly off the notes too and just fills in the blanks. Gives a lot of HW and the timing can be harsh sometimes (we once had HW and a project dueon the same night, and a quiz in class the next morning).', ""Professor Breen is amazing. 2121 and 2122 have a decent bit of homework and can be tough but nothing excessive. Her lectures are very clear and she is happy to clarify things. She is very easily accessible outside of class. She was very helpful with any questions or issues. Take her class! I'm glad I had her for both classes."", ""She has to look at her notes to make sure she's right when teaching, not sure if she doesn't know what she's talking about or if she's too smart to teach. She's pretty sarcastic and not much help when you ask for it. A lot of homework and the tests are really hard even if you understand the material. Wouldn't recommend"", ""Solid professor who knows what she is teaching. I don't know what people are talking about when they say this class is difficult. If you actually do the homework and study a reasonable amount it is fairly easy. Only complaint is homework was sometimes uploaded like a day before it was due. Take this professor."", ""I've talked to people in other sections and they don't get as much help as we do (notes, quizzes that resemble the test). Humble, helpful, kind, wants you to do well, grades on curves when needed, extra credit points. She's a real gem and makes you feel known even in a large class."", 'a lot of work to do, quizzes, homework, papers, SI class and in the test is something totally different specially the 3rd test. she is soooo fast you cannot understand anything from her. the worst class I have ever taken in my life', 'Professor Breen is my best professor yet. A professor that actually knows what she is talking about. The lectures are super helpful and she gives lecture outlines so note taking is easier. There are a lot of online assignments, as long as you keep up with those and study for the tests, this is a good class.', ""While accounting is generally a difficult class as long as you pay attention and do you homework you will be fine. Far too many of my fellow students used chegg or other services to complete there homework and suffered because of it. If you pay attention and do all your homework you are sure to get A's or B's on the tests.""]",3.9,"['awesome', 'awesome', 'awesome', 'awful', 'awful', 'average', 'awesome', 'awful', 'awful', 'awesome', 'awesome', 'awesome', 'awful', 'awesome', 'average', 'awesome', 'awesome', 'awful', 'awesome', 'awesome']","['4.0', '5.0', '5.0', '1.0', '2.0', '3.0', '5.0', '2.0', '1.0', '5.0', '4.0', '4.0', '2.0', '5.0', '3.0', '4.0', '5.0', '2.0', '5.0', '4.0']"
2,https://www.ratemyprofessors.com/professor?tid=46622,"[""Your grade is based almost fully on three papers you write over the semester. But as long as you kinda know what you're doing, its pretty easy to get an A or a B. Overall he's just a super cool professor. Most of class is spent on completely off topic stuff but that was the best part of the lectures"", ""He was a decent professor. He was the hardest grader I have ever had. If you aren't an English major I don't recommend him.  You can't miss over 3 classes or your grade goes down by a letter grade. We read 5 Shakespeare plays & I don't think I gained much from him. He gives out daily quizzes but you can usually avoid them by getting him off topic."", ""Good guy. Talks about random unrelated things a little too much. He wont give you a rubric or outline for papers so if you are the kinda person who likes to know exactly what the professor wants don't take him because he will not tell you, he will just give you an F."", ""Love him. Shakespeare was fun with him. Doesn't know how to start or end class on time and doesn't always stay on topic, but funny and really truly cares about his classes. Will like you if you're liberal, participate, and witty. He loves to see students who care but also likes to joke with students with a sense of humor. Great guy, take his class."", 'Awesome professor, made Shakespeare a lot more interesting than it would be presented otherwise.  Small quizzes over readings almost every class, so be ready for that.  No exams, instead he does 3 papers throughout the semester. Cool guy, would definitely take again.', ""A very kind, knowledgeable man. He tends to go off on tangents, but they're usually interesting. This isn't the kind of class you can do the reading for the night before."", ""Sometimes he can act a bit pretentious, but he's a good professor and pretty likable. The books he chooses for the class are actually really interesting, and he gives short quizzes on the reading almost every day. As long as you actually read the books, you'll do well in the class."", ""He was the worst prof I've ever had. His lectures consisted of his opinion on politics, religion, and how he thinks life should be lived. If you did not agree with his views, you were wrong. He would humiliate students in front of the whole class. I had an assignment every  night, and dreaded going to class. Would never take again."", 'Do not take this professor. This class was one of the worst I took at KSU. He never shows up for class on time, and never releases the class on time. He lectures the whole class, about subjects that are completely unrelated. He spews his opinions of religion and politics. There are quizzes every single class, & he is a tough grader on the papers.', ""One of the best, smartest, most thoughtful teachers I have ever had. If you really want to learn and ask big questions; take Schmitzer. He has high standards, you'll have to workwhich is what you're paying for anyway. Take him. Learn something."", ""Long, boring lectures. Won't answer questions because they might be quiz questions. Daily quizzes. Attendance matters. Changes due dates and is very unclear. I got a C- on the first paper and was able to finish with an A after a lot of work. You have to read a lot. No final. You'll have to write 2 short and 1 long research paper. Wouldn't recommend"", ""He's a fantastic professor, no doubt about that. He can be somewhat self-righteous and occasionally snobby, but he knows what he's doing. Once you understand what he wants from you, it's pretty easy to provide it for him. Class was simple, and he went off on a lot of tangents. Just be prepared to do a lot of reading."", 'Professor Schmitzer can be very helpful when you need him to be. He gives plenty of opportunities to excel in the class, as long as you do your part and stay prepared. He can definitely go off on random tangents, and tends to talk about unrelated-yet-weirdly-related subjects at times. Overall I love his Class.', ""I loved this guy! Made me laugh and taught very well. He goes on tangents a whole lot but it pushes off a quiz. There is a lot of reading but honestly Sparknotes will pass you 100% of the time. He has 3 essays too due throughout the semester but they aren't anything you haven't done."", 'Yes, he makes you read a lot and yes he does make you take a large amount of quizzes but I promise you that what you learn in this class you will retain forever. He often goes on rants that will last the whole class period, you can easily get him off track if you really want to avoid taking a quiz. He is a tough grader but worth it!', ""Honestly not my favorite guy. He did not give a lot of explanation in regards to papers and when I would ask for clarification he would go on a philosophical tangent about how I gave up.  He can be funny, if you like sexual humor (which I do not).  While I didn't like him as a prof, he seems like a chill guy. "", ""I had T.C. for College Writing II as a Freshman this past semester and he is honestly one of the best instructors I've ever had. The course work is by no means stressful and grading wise, he is no harsh. As for papers, you have a minimum of 1200 words which usually is around 5 pages but, the material is interesting and so is he! You won't regret it"", 'Prof. Schmitzer is absolutely amazing! I went into his colloquium class with no interest in the material, and left the class upset that it was ending. By far my favorite college course and my favorite professor. Extremely knowledgeable and interactive, lectures are always interesting. The class completely changed my view on so many things.', 'Quizzes every day over reading. Reading assignments are not lengthy and papers are a MAX of 3 pages. Tough grader, usually got As in English but got a B in the class. Funny guy who made you work for your grade.', ""I thought College Writing 2 was going to be so hard. This guy is arguably the best English teacher I have ever had. You take small quizzes over the books you read and there's only a paper per book!(3pages). Thats it. And all you do is openly discuss topics and how it relates to the books. He is so full of knowledge and very witty. I urge any n all!""]",3.4,"['awesome', 'awful', 'average', 'awesome', 'awesome', 'awesome', 'average', 'awful', 'awful', 'awesome', 'awful', 'average', 'awesome', 'average', 'awful', 'awful', 'awesome', 'awesome', 'average', 'awesome']","['5.0', '2.0', '3.0', '4.0', '4.0', '5.0', '3.0', '1.0', '2.0', '5.0', '2.0', '3.5', '4.0', '3.0', '2.0', '1.5', '4.5', '5.0', '3.5', '5.0']"
3,https://www.ratemyprofessors.com/professor?tid=47102,"[""Class was a little difficult at the beginning; he realized non-science majors don't know much. Learned a lot about the application of chemistry to everyday life. Quizzes were always planned and passable with extended study. Liked that powerpoints were the main tool utilized. Drew molecules on board- TMI. Would recommend if science is your forte."", 'Dr. Pholmann + Organic = Fun', ""He is a great Professor, people just don't take the time to study and they blame it on him. I Studied for his class everyday and I did really well. Dr. Pholmann is tough but I still remember every synthesis reaction."", ""I'm torn up about this class. I really don't know if there's a better way to teach the material. I thought lectures were pointless, although you still have to attend b/c he requires a summary of each lecture. Reading is a MUST (to grasp the material). Exams are dreadful. On the upside, I think Pohlmann DOES care. Tutoring/WICKS are meant to cushion"", 'absolutely horrible experience.  How can we learn this much material if all the professor does is read the slides.  It is a shame that this course material is on national exams and we have such poor preparation.  May the lord be with anybody taking this course', 'This class was kind of nightmarish at times because there was so much material to study!', ""Dr. Pohlmann knows his stuff.  You can't expect to learn this type of material by reading slides three times a week. He does his job of presenting the information to the students, and it is up to you to study.  He gives plenty of opportunities for extra credit and he'll help you whenever you ask.  Good professor for this difficult of a subject."", 'he is a super nice  guy, but does not teach that well. the course is self-taught with the help of tutor and other extra credit. he is the only organic teacher, but regardless, i still recommend him!', ""Great professor. It can be a tough subject but he will help you until you understand. Don't expect to learn everything during his lectures... you have to do lots of outside work. Would recommend him if he weren't the only organic teacher. Offers 5 easy bonus points to final grade!"", ""HE'S THE WORST ORGANIC CHEM PROF OUT THERE!! HE CAN'T TEACH IF HIS LIFE DEPENDED ON IT!!"", 'No Comments', 'REALLY nice guy, but probably not the best organic teacher. kinda put me to sleep. good for an advisor because i tell him which classes i want and he puts me in. not a whole lot of people have him as an advisor too...no long lines', 'A pretty good teacher for such a difficult subject.', 'hmm...organic chem kinda sucks...think he did the best he can, considering how much material there is...and how little interest most of us have in it...', ""He sucks as a teacher. Unfortunately, he's the only Organic Chem Professor."", ""He does the best he can for teaching classes of a large size.  He's pretty approachable outside of class and I took advantage of that.  The WICK's didn't help me much, but I didn't put much effort into it.  It's possible to pass his class and even get A's, but you really can't slack off."", ""his class for me is to catch up my sleep coz u won't understand anything. but if u approch him outside of the classroom, he will help you as much as he can."", 'No Comments', 'organic chemistry could be so much easier, but he knows so much he kind of expects you to learn all what he learned in grad school in one year of undergrad. totally passable esp. if you have the tests from the past few years. very nice man though.', 'Below average organic chemistry professor in teaching']",3.2,"['awesome', 'awful', 'awesome', 'average', 'awful', 'awful', 'awesome', 'average', 'awesome', 'awful', 'awesome', 'average', 'average', 'awful', 'awful', 'average', 'awesome', 'awful', 'awesome', 'awful']","['4.0', '2.0', '5.0', '3.0', '2.0', '2.0', '4.0', '3.5', '5.0', '1.5', '4.0', '3.5', '3.5', '2.5', '2.5', '3.5', '4.0', '2.0', '4.0', '2.0']"
