,prof,review,rating,emotion,quality
4,https://www.ratemyprofessors.com/professor?tid=47104,"[""Taking nature with her is like taking a Nutrition course, she bases everything in food intake, properties of food products, health problems related to food. She is not an interesting professor to take morning, nor afternoon... nor late courses. But I have to admit it is an interesting course and it's an easy A. Take advantage of the extra credit!!!"", 'Dr. Wahl is a great professor! She has a passion for genetics and makes the material easy to understand! She is always there for her students! Overall, it is a very rewarding class! Just make sure you show up and pay attention!', 'Not the most exciting class, but super easy.  If you do not get an A in this course with her generous policy you are doing something wrong.', ""she's super boring but fairly easy.you can sleep in class everyday & still can an A. Attendance is very important to her & will drop you if you dont meet the requirements."", 'Dr. Wahl makes everything easy to understand because she is very detailed and teaches at a steady pace. Lectures are easy to understand. Exams are write-out genetics problems. Her example problems are basically model examples of what she expects. Drosophila project is time consuming. Easy A if you can devote the time. A lot of extra credit offered.', 'I dont have a problem with the course, molecular biology is great, Dr. Wahl is extremely annoying.  She should hurry up and retire!! Too old!!!', 'Great course! and great professor.  People should give Dr. Wahl more credit.  She is actually a great teacher and presents the material in a manner that is easy to understand!', ""This class is extremely enjoyeable, I love the drosophila project and the way that Dr. Wahl teaches!  Best professor of Biology at St Mary's!!"", 'Excellent class.  Dr. Wahl is an exceptional professor and a wonderful adviser.  Other professors should take their cues from her.  Personally, she should be restored as chair!!  I reccomend this course without reservation.', 'Dr. Wahl is a really neat professor.  She was always available for assistance and provided students with great reassurance in regard to their grades.', 'Dr. Wahl is an average professor, she explains things very slowly which at times can be rather annoying.  As it is there is not too much information covered in this class but she stretches it out to last the whole semester.  there is ALOT of extra credit and the drosophila project to contend with.  I would recommend this class if you can tolerate l', 'verrrry boring...OMG...she is a huge stickler bout absences and will drop you in a heartbeat if you exceed the allowed amount...she dropped 4 students...her tests are easy..alot of chances for extra credit..you can fail every test and still get an A in the class..she explains everything like your 5 years old...if you can tolerate boring, take her', 'Objectively, fairly good professor. However, has an agenda on favoring 4.0 students and neglecting 3.0 and below students. Students are Her statistical pons in a political game of professional school admittance track record. Recommend alternate advisor. History of neglecting transfer students and discouraging their applicant process.', 'No Comments', 'Class was alright.', 'She goes very slow in the class to make sure you completely understand the material.  You only need to take note of what she writes on the board, the exams are completely hand-written and take at least 2 and 1/2 hrs.  but still get good grades', 'Not a bad class at all. Prof.  over simplifies somethings..wish a little more depth would be taught to prepare for careers in the sciences', ""Be prepared to be in lab until 7 PM (on average). Easy class but pretty boring. I think its good to take the class when you are preparing for the MCAT b/c it doesn't require a lot of studying."", 'Easy class, just a good amount of work to contend with. After taking the class, i wondered why there were 40 people in the class...just doesnt seem like a very necessary class to prepare for the MCAT.', 'No Comments']",3.3,"['average', 'awesome', 'average', 'awful', 'awesome', 'awful', 'average', 'awesome', 'awesome', 'awesome', 'awesome', 'average', 'awful', 'awful', 'awesome', 'awesome', 'awesome', 'awesome', 'awful', 'awful']","['3.5', '5.0', '3.5', '2.0', '4.0', '1.0', '3.0', '5.0', '5.0', '4.5', '4.5', '3.0', '2.5', '1.5', '4.0', '4.0', '4.5', '4.0', '2.0', '1.0']"
5,https://www.ratemyprofessors.com/professor?tid=47125,"[""Everything I have to say would mostly repeat what's already been said. I WILL say that he is one of the best professors - if not THE best professor - I've had at UNC."", ""If only he had cared more about us as a class, I would've liked it more. He blew us off four times and we had a substitute three - that was terrible. But when he DID come, he was an awesome teacher that made special relativity actually *interesting* The tests aren't too bad - just make sure you keep up with the work and the constant online quizzes."", ""Excellent Teacher. Funny, full of energy, one of the best I've had at UNC. Totally knows what he is talking about and easily explains it to students. Tests are a bit difficult, but he curves."", 'Great teacher who really knows his stuff and does his best to help the students learn it too. Very entertaining and managed to keep me awake even at 8 AM. Lectures and reading are a definite must, and the tests are somewhat difficult, but if you keep up with the work, not too bad.', ""He is a very good lecturer.  He is very energetic and tries to help students understand what he is talking about but will not slow down unless you ask him to, so if you're not understanding the topic say so.  Study well for the tests they are pretty hard, but he does curve.  I definately recomend taking this class.  Also comes with an easy lab"", ""Great teacher. Makes space interesting. He's a very smart man but knows how to relate to his students. You can tell he really cares about making his students understand astronomy. Curves tests in relative to the class as a whole. Strongly recommend."", ""Funny teacher with a lot of energy. A lot of the questions on the quizzes are from the CD-ROM in the textbook. Class is not about looking at stars and constellations. It's mostly physics."", ""Great teacher! He does teach from a ppt, but you don't have to copy everything -- he even suggests you don't. But he's hilarious and great at explaining hard concepts. Most entertaining class I've EVER had at UNC. And the tests are not easy, but they're not hard either, and very little hwk."", ""This guy is FUNNY! HILARIOUS!  I used to get baked and go to class just to laugh.  Remember, what we perceive as gravity is only the distortion of space time.  His tests are medium difficulty wise but he's soooo into his lectures.  At least he was in 1995.  I loved him.  Not literally."", ""Very funny and nice guy...HOWEVER...teaches via powerpoint which makes it difficult to pay attention most times.  TOO SMART TO TEACH! He understands exactly what he means - but can't really put it so the uninitiated will understand.  Reccomended if you're naturally good at science - unlike me!"", 'Information is tough, but study your butt off and the exam is relatively simple.  McMahan is a great professor.', 'SO much info, hard to keep up, Difficult test', 'Good lecture information.  Relatively easy exams.', 'No Comments', 'very hard class with a too-smart-for-you professor']",3.9,"['awesome', 'average', 'awesome', 'awesome', 'average', 'awesome', 'awesome', 'awesome', 'awesome', 'average', 'awesome', 'awful', 'awesome', 'awesome', 'awful']","['5.0', '3.5', '4.0', '5.0', '3.5', '4.5', '4.0', '5.0', '4.0', '3.0', '4.5', '2.5', '4.0', '5.0', '1.0']"
6,https://www.ratemyprofessors.com/professor?tid=47142,"['Wow just wow...most of the bus190 course are full and i look at the rating for this professor and he looks horrible but still deciding to check him out. Went into his class and there are about 7 students only. First day he was so boring and got off topic so much. I can tell this class was going to be frustrating so i dropped it the first day!', ""Hard course and really hard professor. I was able to pass with a B because there was an extremely smart tutor who took his class previously, which made him upset at having to deal with so many students from Smith's class since there was no other tutor that was able to understand his horrific book. If you take him, please find yourself a great tutor"", 'Smith is an academian who brings no real-world experience to the class and suffers from a displaced smirk syndrome. Communication with Smith is a problem. Lectures are erratic math problem solving attempts. Monochrome textbook with missing pages and misplaced paragraphs is his own creation. The 2 projects add no value but take too much time. <B6>', ""I usually don't say this, but this man is not fit to teach. Knows the material, but dosn't know what teaching is. HW is graded on 3 points, so get even one number wrong and there goes 1 of 3 points. Exams are easy if you understand the HW, which most people don't. There are no answer keys, he dosn't go over all the hw. Avoid this man at all costs."", ""This man should not be teaching.  I had to go to another professor's office hours to get help.  The book, lectures, and the professor himself are USELESS!  He makes everything as complicated as possible.  DO NOT TAKE THIS PROFESSOR!! IF HE'S ALL THATS LEFT, WAIT A YEAR IF YOU HAVE TO!"", ""Ok, I am generally a good student. But this professor makes understanding the subject so difficult and confusing. I wish I could explain to you how much I disliked this professor. If you can, choose a different professor, you'll be much happier."", ""Do not take it you can avoid him.  He uses his own book, which is as confusing as he is.  Its like he needs to say something and then thinks of the most confusing way to say it.  If you don't understand he keeps saying well let me show you a different way instead of actually explaining 1 simple way.  Class is always behind the schedule. do not take"", 'Prof Smith comes across as goofy. He is a very nice guy. Class can be confusing. Suggest to get group of 2-3 students & visit him during his office hours! Really! He does take his time explaining the material. Read the book, practice, & do your HW. Show interest. I got A, you can do it, too! GD.', 'Smith is old and old. He wrote his own book and it is terrible. Homeworks are useless and he grades them hard. You could spend and  2 hours on it and get 0 out of 3 points because he is old and crazy and feels your answers are not perfect. Good news you only need 45 percent to get a D. You wont learn anything, but you have to be a moron not to pass', 'This professor is terrible. He CANNOT answer a strait forward question to save his life. His lectures are hard to understand because he takes 1.3 hours to explain something that should take 5-10 minutes tops. The textbook should be skimmed for the concepts and answers to the questions.', ""Horrible teacher! He uses his own book & language to teach the material. He speaks in PhD language. I went to the tutorial center, and they said they could help me with any other teacher but smith! I went to his office hours and he gives off this 'you are dumb' squint. I wouldn't recommend him. There are plenty of easier teachers out there!"", ""just awful... this guy is so bad at teaching I had to get a different text book and use google searches to teach myself the material and even then I had to translate what i learned into his reatarded way of doing things, this guy should be fired (if it wasn't for tenure)"", 'Useless teacher, doesn\'t know how to comprehend. You will hear him say ""Let me rephrase this"" about 500 times in the semester and it still doesn\'t make any sense. The book is garbage because he wrote it, might as well throw it in the trash (along with him). I am getting a good grade in the class because the exam is very easy, but HW is frustrating.', ""he's a nice guy.  i don't find his class too difficult.  i think he's about to retire.  best wishes for dr. smith."", ""He can be very unclear especially if you're not good with math. The book is also very unclear and freakin every line is bolded or underlined! You have to reread the chapters several times. Exams are easier than the HW. He does curve, but not by alot. Project was confusing. Overall, the teacher was confusing and very unclear."", ""Easy grader...BORING subject and prof though.  Keeps you after time's up on the class...Take another one that's recommended if you can"", 'Grading was partially easy and depending on how much homework you do, this class can be easy.  He does go off topic ALOT! Sometimes the problems that he goes over may rollover to the next day which makes it hard to understand the material at times.  Group discussion and Grouping together to do homework helps alot.', ""Hes hard to understand, I went to class everyday and still didn't understand when was going on in the class i went to his office hours and it wasn't much help either don't take him."", 'very tough class', ""You pretty much have to concentrate on the book. The class could be fun if you have an interest and commitment to decision sciences. Otherwise, you'll get lost. You can go to the tutoring center in the business tower... the people there are very helpful.""]",2,"['awful', 'awful', 'awful', 'awful', 'awful', 'awful', 'awful', 'average', 'awful', 'awful', 'awful', 'awful', 'awful', 'awesome', 'awful', 'awful', 'awful', 'awful', 'awful', 'average']","['1.0', '1.5', '1.0', '2.0', '1.0', '1.0', '1.0', '3.5', '1.5', '1.0', '1.0', '1.0', '1.0', '4.0', '2.5', '2.0', '1.5', '1.0', '2.0', '3.0']"
7,https://www.ratemyprofessors.com/professor?tid=47210,"['A couple things other reviews havent mentioned yet... Students grade each others tests&he gives the answers on the test the class before. 2 absences are allowed however if you have a borderline grade he will take that into consideration. Highest grade he offers on the presentation is a 95 (doesnt believe in 100). He also lets class out early.', 'Average professor. 4 tests and 1 presentation. The questions on the test and the PowerPoint slides are straight from the textbook. Highly recommend taking this class online. It will save you time.', ""Lol. Long lectures that have nothing to do with anything. Rambles on. Tests are very tricky and long even though he says they're easy. At least he gives us some answers and the word bank for the fill in the blank. That's the one thing I liked most. Those were super helpful. He's ok. I'd take him again"", 'Class was kind of pointless. He shows the test and gives the fill in blank portion for the tests. He says the test arent tricky but they truly are. He knows a lot though.', 'I personally did not care for this professor. Nice guy, but rambles on a lot and the tests were tricky, even though he says theyre not. This may just be me being salty, but I dont see why I didnt get an A in this class', ""Lyons is a great prof. He's funny and will help you prepare for the exams. One paper (which he grades kind of harshly on) and four exams, which he gives a study guide for and are easy if you study.  Go to class, study, laugh at his jokes, and you will do fine!"", 'Nice guy but he says his test are not trick, but they really are!', 'Four tests and a presentation.  He stresses attendance and tries to keep the class interesting. He provides a review session before each test.', ""GREAT teacher. Makes the material so much more interesting than you could ever expect from a teacher. Class is always enjoyable! I'm in it once a week and we never stay  whole time, either. Tests are combo fill in the blank/ multiple choice, but he gives you a word bank- and tells you these words the class before the test so you know what to study!"", 'He makes something that could be a really hard class really easy. Presentations are really easy and the tests are really easy if you study.', ""Interesting class. Had it once a week. Can't miss more than 2 classes or it affects your grade. Nice guy. Very clear about what you need to do. Stupid presentations but relatively easy. Need to study for quizzes but not too bad."", ""What a great guy!  This class had the potential to be pretty boring but he makes it interesting.  He's such a character too, and a very easy teacher.  Straight from the powerpoint, tells you what you need to know, and tries not to keep you too long if he can avoid it.  He's funny too, and a silver fox, so it's a great class all around."", ""Silver.Fox.  Notes right from the book, tricky tests, draws out powerpoints but we have never been in class the entire scheduled time. He is the only one that teaches this so you are SOL if you don't like him."", 'Great teacher! Goes over tests after being handed back and will give you the point if there is any discrepancies. Takes attendance but if you go to every class and you are borderline at the end of the semester he will bump you up! Take notes and you will do very well in class!', 'he was the best teacher i have ever had throughout all my years in school. this is my 5th year at towson because i switched majors, & he was the most helpful, most interesting, & the most concise.', 'he was a nice guy, but his powerpoints are realllllyy long!!! He gets off on alot of tangents which makes his class last alot longer than it needs to! But all together nice guy-- attendance is mandatory, tests can be difficult, term paper is graded very hard!', 'I thought he was hilarious, good teacher, tells you what you need to know to take his test.  He is very knowledgeable about the subject.  Easy B.', 'I thought Lew was a great professor! He is very smart and wants his students to do well, so he tells you the things to study for the test so you learn the important things and not a bunch of worthless stuff. I definitely recommend him. He is very helpful in the classroom and in life!', 'four ""quizzes"" which are  really just tests; takes attendance, gives you 2 freebies, then takes off 10 pts every time you miss after that.  If you wanna have a chance for a curve on your grade at the end of the semester, go to every class and don\'t miss any, he takes that into account when curving.  Hard on paper grading', ""unfair, egotistical, condesending, takes attendance. does not explain very well. pretends he's telling you what's on the test but its way more complicated then he implies. horrible class""]",3.6,"['awesome', 'awful', 'average', 'average', 'awful', 'awesome', 'average', 'awesome', 'awesome', 'average', 'awesome', 'awesome', 'average', 'awesome', 'awesome', 'average', 'awesome', 'awesome', 'awful', 'awful']","['4.0', '2.0', '3.0', '3.0', '2.0', '4.0', '3.5', '5.0', '5.0', '3.5', '4.0', '4.5', '3.5', '4.0', '5.0', '3.5', '4.0', '5.0', '2.5', '1.0']"
8,https://www.ratemyprofessors.com/professor?tid=47292,"['HE was an awesome teacher, who showed intrest in his students.', 'GREAT TEACHER. HOPE HE IS DOING WELL WHERE HE IS NOW. GO BEARCATS!!1', 'great professor, very helpful, really awesome at showing how to put together speeches...i learned a lot in that class', 'I doubt Scott ever checks this, but just in case: I miss you! (And thought of you when I went to Disney. Tigger was there!) USI lost a great instructor when you left, but your departure is completely understandable. Hope everything is going well.', ""Mr. O'Daniel was the best teacher I've had at USI so far.  I had absolutely no desire to take a speech class...now I'm minoring in speech.  He does everything he can to make the class informative.  If you prepare, you'll do great.  And you'll have fun!"", 'Scott is one of the best teachers I have had at USI.  He really cares about the students, and makes class fun.  Everyone should take his class!!', 'He knows what he is talking about, and despite what people say, he is not full of himself.  Some of you need to learn to listen.  :D Anyway, I give him an A+ for being a great professor.  I feel so much more confident after taking his classes.', ""He stands in front of class like he is God and everyone is beneath him.  I'm tired of being preached to."", 'All he likes to do is stroke his ego.', ""Okay, O'Daniel doesn't give sermons. He makes fun comments along with the imporant stuff. Oh, and whoever said that O'Daniel thinks he is hot, you did not listen. O'Daniel actually slams himself in that category.  Doesn't think he's attractive at all."", ""This guy only wants to hear himself speak.  If I needed a sermon, I would go to church.  Someone needs to tell him that he's not as hot as he thinks he is."", ""O'Daniel is a great professor! He helps you so much and he treats you so nicely. Even though purposely he calls me Allison."", 'Have had several classes with Scott. Very nice/motivated/caring/intelligent prof. Knows/Loves what he is teaching & it shows! Will do anything for those who work. Honesty, integrity, accountability & reading will get you an A or B!', ""the most amazing thing, he CARES. Though the class isn't too difficult, you can get a lot out of it if you put in a little effort. Mr. O'Daniel is a great guy, and an amazing teacher. Treat him with respect!"", ""Passionate about what he's teaching, and very effective teacher. He enjoys teaching and loves to help you learn. The projects were fun, and the information I learned was day-to-day useful. Everyone should take this class, and Scott!"", 'No Comments', ""O'Daniel was soooo much fun!  He's the sort who actually seems to care about and befriend everyone in his class.  If you're a USI student and haven't had this guy yet,  get your bum into his class!  He's rockin'.  Jeez...I hope this doesn't go to head."", ""O'Daniel.  What can one say about O'Daniel?  Well..O'Daniel likes Tigger and Donald Duck.  Yes..yes he does.  This is very hot...go disney characters!!  Also..he is even more awesome, if that's possible, when he wears suspenders."", 'No Comments', ""he's a sexy fine teacher who really knows his stuff. call me dude!""]",4.6,"['awesome', 'awesome', 'awesome', 'awesome', 'awesome', 'awesome', 'awesome', 'awful', 'awful', 'awesome', 'average', 'awesome', 'awesome', 'awesome', 'awesome', 'average', 'awesome', 'awesome', 'awesome', 'awesome']","['5.0', '5.0', '5.0', '5.0', '5.0', '5.0', '4.5', '1.5', '2.0', '5.0', '3.5', '5.0', '5.0', '5.0', '5.0', '3.0', '5.0', '5.0', '5.0', '5.0']"
