,prof,review,rating,emotion,quality
0,https://www.ratemyprofessors.com/professor?tid=78884,"['A little forgetful, disorganized', 'This course requires dedication and work, but rewards well. Professor guides well and is clear at what she wants. Professor is easily available, helpful & patient. Regarding easiness, the description of easiness as it goes higher is disgusting on this website. You will get a better grades if you go to professor, discuss, and follow corrections. ', 'Very nice, extremely helpful. Gave me great constructive criticism to improve my junior honors thesis. Would definitely consider one of her classes if I needed another English class.', 'excellent', ""I thought she was a very nice woman, but she is a VERY HARD grader. if you're not a Lit major I wouldn't recommend taking her."", ""Lovely woman, brillant mind. I loved this class, open discussion is a MUST! Fair grader, good conversation. It felt like a book club! Tests and papers are fair, but make you think. Always on time, always have class, no early dismissals--But you don't want to leave early anyway."", ""Fantastic lady, very intelligent, but don't goof off.""]",4.3,"['awful', 'awesome', 'awesome', 'awesome', 'average', 'awesome', 'awesome']","['2.0', '5.0', '5.0', '5.0', '3.5', '5.0', '4.5']"
1,https://www.ratemyprofessors.com/professor?tid=79136,"[""Awesome Professor. I'm not a physics person at all but when I asked him for help he would always help me till I understood. He also graded the labs and quizzes very leniently and gave points wherever possible. Take him for physics lab"", ""The most boring professor I've had in my entire life.  No one can pronounce his name which is why people rate him under Rao B.  If you need to take a science class at OU take this one, thank god we only had him for 1/3 of the class. 4 homework assignments multiple i clicker quizzes and one final quiz."", ""Rao knows his stuff, if you take the time to engage him he is very helpful. I will say this no matter what class I'm in, if I need help in the labs this is the guy I'm going to."", ""very good prof. slightly hard to understand, but very easy if you study. practice exams are on reserve in the library and he won't ask you a type of question that isnt on them."", 'Really nice guy, he has an accent but you can understand him just fine, I dont know what people are complaining about, hes not that bad. The class was pritty easy, the HW assignments where simple and he goes over all the questions in class. The labs that go along with the class are easy too but take time. Study the practice tests and ask questions.', 'Real nice guy but I think people are really ignorant towards him for his heavy accent, give him a break.  Always willing to help and will answer all your questions.  Was a nice break from having Dr. Russel teaching our class.', 'Easy class!  Exam problems come from practice tests in the library and are straightforward!  Yes, the professor has an accent, but it IS understandable!  Do your homework (only maybe 2 hrs at the most a WEEK) and study for exams and you will get a good grade!  I would def recommend him!', ""He's hard to understand but you get used to it if you pay attention.  Exams aren't that bad.  I still enjoyed the class nevertheless."", 'Hard to understand, but tests are easy', 'Very good lectures, but you have to listen carefully to understand him.  Tests are very easy and similar to examples in the text.', 'No Comments', ""Oh wow! This should be classified as a foreign language class. I had to drop it b/c I couldn't understand a word he was saying! Do not take this man unless you are fluent in his language!"", 'Super guy! Take him if you can.', 'Hard to understand in class, but tests are easy!', 'not easy to understand (say again?)', 'No Comments', 'Great guy, very nice', 'Hard to understand, but hes very nice']",3.3,"['average', 'average', 'average', 'average', 'awesome', 'average', 'awesome', 'awful', 'average', 'awesome', 'awful', 'awful', 'awesome', 'average', 'average', 'average', 'awesome', 'average']","['3.5', '3.0', '3.5', '3.5', '4.0', '3.5', '4.0', '2.5', '3.0', '4.0', '1.0', '2.0', '4.0', '3.5', '3.0', '3.5', '4.5', '3.5']"
2,https://www.ratemyprofessors.com/professor?tid=79240,"[""tremendously liberal.  I'm glad I pay money to people who in turn tell me how to think.  ridiculous class to say the least.  uses very little logic.  way to idealistic and not realistic."", ""Prof Roberts isn't necessarily the best at actually teaching the material, but it doesn't really matter for her class because she makes her tests from what she says in class. Go to class and answer questions the way you think she would answer them and she will love your answers. Very easy A if you go to class half the time."", 'GREAT CLASS! Very cool professor who is extremely helpful and always facilitates good discussions. She sends out her powerpoints and gives a study guide before each test, so if you do the reading (which I always did the night before) you should do fine! This was one of my favorite classes!', 'No Comments', ""Great teacher, great person. Canceled class one time this semester! Doesn't just talk about Iraq anymore. Teaches from book, but much on tests is from lecture. Skim book, go to class. Good discussion, learn a lot. Cares about students, understanding, never harsh. Class interesting with lectures and student presentations."", ""I really enjoyed taking her class. She's really sweet. Willing to help. Tests are a little confusing at times, but I would take this class again."", ""The worst!! Very boring !!!! Class sucks!!! Skips around a lot !! Don't take the class if you don't have to !! Or if you do read the book and don't worry about the lecture you will get NOTHING out of it except that you will know everything about Iraq!!"", 'No Comments', 'bad professor.  has been absent more than me...which says a lot.  unclear notes..unclear lecture=ok grade.  take it if you need a nap everyday.', 'Suffers from Liberal paralysis.  Fairly inclear in lectures but loves her subject.  Logic in discussions is lacking.', 'go with old formula book=A, go to class if you like liberal bush bashing', 'Pathetic! Does not lecture, just talks about Iraq, Just read book = A', 'Isnt that bad if you read the text, take notes, loves politics', 'test are easy, not very clear', 'skip class and read the book=good grades. all she talks about is Iraq, borring']",2.6,"['awful', 'awful', 'awesome', 'awful', 'awesome', 'awesome', 'awful', 'awful', 'awful', 'average', 'awful', 'awful', 'average', 'average', 'awful']","['1.5', '2.5', '5.0', '1.5', '5.0', '5.0', '1.5', '2.0', '1.0', '3.0', '2.0', '1.0', '3.5', '3.5', '1.5']"
3,https://www.ratemyprofessors.com/professor?tid=79276,"[""I loved this professor because he cut straight to the point of what you should know in his class to get a good grade. He is easy if you take time to do the HW and really learn the theorems and not just memorize them. He seems intimidating but go to his office hours, he's nice"", 'He didnt give many examples in lecture, but his TA did. Only thing he did in class was giving profs. However, his exams were okay if you study.', 'Love his style of explaining the concepts, very detailed. The tests were fair. I really like him. Wish he would stay and not retire. He is perfect for analysis.', 'The class was difficult, (C+ average) but I felt he especially tried to make sure we understood the material.  He is more engaging than other profs.  Very kind.  The material was difficult, and the midterm and final were mostly proving theorems.  The hw was very difficult but he tried to make sure we understood it.  I actually felt I learned stuff.', 'The class is hard, the median was C+, but Professor Reilly is great. He is not boring whatsoever, in fact he is engaging. You will learn a lot in his class. We have weekly hw and one midterm and a final. Take him!', 'A great professor! He is very thorough, clear, and concise. His test are fair, though on the long side. He grades generously (lots of partial credit). I would take him again for another class, you actually learn the material. The material is tough, but he makes it understandable. Weekly hw & extra questions to be answered during discussion.', 'I like him', ""he does proofs in class (which I hate), and he's really boring. discussions are mandatory but are the only things helpful. his tests are hard because they're ridiculously long. the tests are those tests where you can't make a mistake or sit there too long to think about it or you'll run out of time. a really bad professor. pray for a good TA"", ""DROP THE CLASS NOW! It's ridiculous what goes on in class. He will scream at you if he sees your phone even if you are in the back, he will open the book and outline it and do one practice problem. If you can teach yourself go ahead because Professor Reilly will not teach you a thing. He is obsessed how the past was and tries to make it the same."", ""I thought he was a good teacher, not the best but straightforward. At least he was better than Sadel. I took tutoring too so that may be why. His tests are based on the homework and what you've seen before so that is good. I would take his class again. I had a good TA too- Luke. Lecture can be boring but he's so funny and he doesn't have to try."", ""He likes to mumble in front of the class rather than explain things. He doesn't really teach, so class is virtually pointless which means everyone is in a state of total confusion for the final. If you have to take this class: Good Luck."", 'Reily assumes that we know all the proofs. TAKE ONLY AS A LAST RESORT. I cannot stress this enough. He does not cover the material in the midterm at all. GO to discussions. It is the only way to get a decent grade on the midterm. His midterm is so difficult you will not have time to check your answers. His homework questions are hard hard hard.', 'Reily assumes that we know all the proofs. TAKE ONLY AS A LAST RESORT. I cannot stress this enough. He does not cover the material in the midterm at all. GO to discussions. It is the only way to get a decent grade on the midterm. His midterm is so difficult you will not have time to check your answers. His homework questions are hard hard hard.', ""Came out w/ an A- in this class, but only bc I was in the tutoring center doin my homework 6 hrs a week. He doesnt give you ex of the hw probs and he doesnt give quizzes, but he makes you turn in your hw and 1 prob will be graded out of the whole packet. I don't mind since I always do it but in dis, the ta can't do the problem all the way thru."", 'Lectures serve no purpose at all as he is extremely unclear and doesn\'t even bother doing anything but proofs. He assigns a load of hard hw problems, only one of which is [strictly] graded making it a hit or miss. Very hard exams. Makes calc way harder than it should be. He\'ll definitely make you ""earn"" your grade; no slacking.', ""Hard hard hard. That's the only word to describe this class. Reilly is THE harshest grader I've ever seen, and considering your entire grade is based on his ease of grading, you either get the points or you don't. That being said, he's not boring... but a laugh or two every lecture doesn't make up for hard work and impossible tests. AVOID."", 'bob reilly..i took this guy for math 2j which is in 2 parts. the linear algebra part was alright, pretty simple and i did great on the midterm. infinite series is hard though. he writes his own book for this part, which sucks as much as his teaching. he talks just like he writes, which is strangely formal. no curve, do not take! for any math class!', ""Easily the hardest math professors I've ever come across. In a nutshell, Reilly gives enigmatic lectures, assigns HARD homework problems graded harshly, and gives very difficult exams. That being said, if you manage to put a little bit of effort into the work and go to discussion section you should be fine."", 'DO NOT TAKE HIS CLASS. This has been one of my worst experiences EVER. He can NOT teach. He give SO MUCH homework EVERY WEEK, up to FORTY questions from the text and they are mostly HARD questions. i hear about other classes getting like ten problems a week. In lecture he stands at the front and goes through examples EVERY CLASS (mumbling). BEWARE.', 'Got a B. Hard teacher, because he is bad at explaining how to do the problems. Does the proofs more than the problems. The questions on the midterms and finals are very hard, so study the practice midterms and final.  Go to discussion very helpful']",2.3,"['awesome', 'awful', 'awesome', 'awesome', 'awesome', 'awesome', 'awesome', 'awful', 'awful', 'average', 'awful', 'awful', 'awful', 'average', 'awful', 'awful', 'awful', 'awful', 'awful', 'awful']","['4.5', '1.0', '5.0', '4.0', '4.5', '4.5', '4.0', '1.5', '2.5', '3.5', '1.0', '1.0', '1.0', '3.0', '1.5', '2.0', '1.0', '1.5', '1.0', '1.0']"
4,https://www.ratemyprofessors.com/professor?tid=79349,"['YES YES YES! He is the BEST! Take him if you get the chance! And he buys dunking donuts and hot coca for his classes all the time!', ""I loved Fr. Whalen, he's the nicest guy. His class is extremely straightforward and gives very clear notes, and gives out study guides for all tests and quizzes. He also brings pizza and soda for the class, and he doesn't make you participate if you don't want to. As long as you show up, you'll be given points for participation. Take him!"", ""Great professor. Gives review sheets before every quiz and exam. Takes attendance every class. His lectures can get long but just pay attention to whats on the powerpoint and what he writes on the board. He's a really nice man and wants you to do well. Gets coffee and donuts or pizza for the whole class almost every other week!"", ""He's one of the best professors I ever had. He's so nice it made me feel bad about myself ï¿½ï¿½If I could I would definitely take him again."", 'Fr. Whalen is the best professor of theology! He grades you by your mid term and your final and several tests that he does through the semester but he gives you the questions for the quiz the class before. He also gives donuts and hot chocolate every week. If you have the opportunity take him!', 'This professor is an easy A. Study/do the review sheets he passes out and you will pass the course. He is really easy to talk to and he will let you make up quizzes. Yes, he does bring coffee and donuts. Also, the class is easy to understand as someone who hates theology I loved this course and would take him again any other class he teaches.', ""Great and easy theology class! He gives out donuts and hot chocolate a lot. His is one of the nicest professors at St. John's."", ""Professor Whalen prefers to be called Father Whalen, but in my heart I call him Daddy Whalen ;) He's my favorite professor of all time. Buys coffee, hot chocolate, donuts, munchkins, soda, and pizza for students. Makes Theology actually fun, and he has a great sense of humor. Gives review sheets before each quiz and exam. Love him <3"", ""BEST PROFESSOR EVER!!! Such a nice man, he buys the class treats almost every other week. Super understanding and kind!!! Overall, he's an easy grader and won't give you a hard time!!"", 'He gives you a review sheet before each quiz and exam which are the same questions just reworded differently. Barely takes off points for wrong answers a on test. Easy grader. Everyone gets an A and donuts.', 'My favorite professor that I have taken at St. Johns so far. Makes class interesting, you do have to write a few papers but very simple and only has to be one page double spaced. Review sheets that are exactly what material is on the test. Would take him again if I could. Gets you dunkin donuts on every holiday! Take him!', 'One of my favorite professors at SJU. He is kind, compassionate, calm, and grades very fairly. He makes it so easy to do well and makes sure you know how to do the assignments. Plus, he brings Dunkin Donuts to class several times during the semester! Highly recommend.', ""You make the decision on your own but I am taking him for 2000 because he gave us all his notes & power points,  goes slow enough for me to understand, buys you the books you'll need for the class, grades easy don't know anyone who didn't get As, and every class runs on Dunkin with coffee and sometimes donuts. Decision made yet? ;)!"", 'Fr. Whalen is the BEST theology professor ever. He is hysterical, especially in his extra credit questions for the quizzes. Be prepared though he assigns a lot of papers but they are no more but no less than one page double spaced. Super lenient in grading. Side note he buys the class Dunkin all the time. I would definitely take him again.', ""Best teacher ever you have to take him for theology he's a really funny guy and he always sends me to get dunkin donuts for the class almost every class and as long as you show up and do the work that is assigned and you show some effort you will most definitely get an A."", ""As far as tests and quizzes go, he gives you the questions before hand. He e-mails the powerpoints to you if you ask. Final is not cumulative and the midterm is the same questions from the midterm packet. Make sure you write down the notes on the board. He's nice and really funny. Bonus: he always buy donuts and hot chocolate."", 'if you attend class its an automatic A. i can gurantee it (que trump voice). Greatest human being ever when u get something wrong hell still manage to accept the wrong answer. i remember i got a 100 on his midterm and i got 6 of them wrong, he literally gave us points for providing answers. great human being. also alot of free drinks and food.', ""I love love love Father Whalen.  He's the prof to take for theology courses.  So glad I did.  He is very sweet man. He gives you all your notes you need.  Tests can be hard but if you study you can get an A easy.  There are 3 short papers too.  Best part is he buys you all your books and every class you get coffee or hot chocolate. I love him!"", ""His class seemed to be a lot of works, but he later cut down lots of essays and assignments. Tests were somewhat easy cuz he did review. Definitely nice professor, gave DD to students almost every class and candies for Halloween and Christmas. He also picked his favorite, so it's better to actively participate."", ""BEST PROFESSOR EVER. take him every chance you get. would always buy us dunkin donuts and has a great sense of humor. TAKE WHENEVER YOU CAN. theres a reason he's the first to close.""]",4.8,"['awesome', 'awesome', 'awesome', 'awesome', 'awesome', 'awesome', 'awesome', 'awesome', 'awesome', 'awesome', 'awesome', 'awesome', 'awesome', 'awesome', 'awesome', 'awesome', 'awesome', 'awesome', 'average', 'awesome']","['5.0', '5.0', '5.0', '5.0', '5.0', '5.0', '5.0', '5.0', '5.0', '5.0', '5.0', '5.0', '5.0', '5.0', '5.0', '4.5', '5.0', '5.0', '3.0', '5.0']"
5,https://www.ratemyprofessors.com/professor?tid=79504,"[""Her lectures are interesting and force you to analyze daily routines/objects in a new, enlightening way. I enjoyed the course's focus and the readings (articles, not long books) were simple to understand and interesting. However, the marking for this class was brutal. The criteria and guidelines were broad; well-written essays receive bad marks."", ""Awesome prof! Her lectures were focused and informative, while also being entertaining and interesting. I learned a lot from her classes. She's super considerate and personable - also very articulate! Would definitely take more of her courses."", 'Interesting assignments and super great lectures. ', 'She is sometimes hard to follow during lectures but the content she teaches is very interesting and her teaching style rocks. She always tries to connect concepts to real-life examples that we could relate to (ex. showing clips from What Not to Wear).', ""Really thoughtful and interesting prof! Nice and wants her students to learn and get something out of the course. People were a bit rude by packing their bags early and talking during class because they thought she was confusing and too wordy. That's true, but it's also what makes her so unique and suited for the complex art of cultural studies."", ""Very effecticve, and likeable. she's not all up on a high horse like some profs. She's easy to listen to and she makes sense! She's also very worldly which makes her super cool!"", 'Good, some classes were boring but then again so were some of the topics.  Easiest class I have taken so far...', ""*snore*... wha.. huh?  Did I miss anything?  Oh, no, just the same thing she's been saying for 10 minutes!  Multiple choice part of the exam was easy though!  LOVED the videos.  Made up for her lecturing."", 'Boring.  Repetitive.  Takes her a long time to get her point across.  Like the videos though!']",3.9,"['average', 'awesome', 'awesome', 'average', 'awesome', 'awesome', 'awesome', 'awful', 'awesome']","['3.0', '5.0', '4.5', '3.5', '4.0', '5.0', '4.0', '2.5', '4.0']"
6,https://www.ratemyprofessors.com/professor?tid=79659,"['Can be a bit boring at times, study for the tests.', ""Can't believe the guy before me took the same class.  Professor Kastner is very interesting, I learned a ton, and he was always willing to meet me when I needed advice. The class is pretty easy but you still need to study.  Instead of a text book, he provides handouts each class, to save us money.  Take this class. It was great."", 'By far the worst professor in the comm major. Teaches professional communication but never responded to an email the entire semester. Professional eh? Surprise assignments, longs lectures, skip taking this class unless you have to.', ""If you're looking for an easy A take this class definitely, but be prepared to be pretty bored! Talks to you about general business stuff for 2 hours. Lets class out early, but I can't tell you one thing I learned in this class. Better to take than Mark Fernando for sure."", 'Great guy. Very knowledgeable and provides practical information for you. Class is ridiculously easy yet you will still learn a lot, and what you learn is actually very useful. I often have issues with part time professors, but this man without a doubt deserves a raise. Take this class, even if you do not need it for your major.', 'This class was  fantastic. Teacher is extremely helpful with things like resumes, cover letters, interview skills...I really found it helpful. Lets night class out early. Easy class, fun topics. Take this class.', 'class gives you a lot of real-world help.  its not a hard class, just do the work and you should have an easy A.  never bought the book and still got an A. fun class, really nice and helpful teacher.', ""Easy class, nice guy. It's either this or  advanced public speaking, and i can't reccommend not taking that class enough."", 'This class is useful for the furture of your job search and internship search. I was excited coming into the course and I feel like it was helpful! Everyone at Towson can get something out of this class!', 'A really easy and useful class, but Kastner thinks way too highly of himself. Kinda annoying to sit through.', ""Take this class! Really easy, you'll learn a lot of valuable stuff about getting a job when you graduate. Most of the test questions are common sense, but you do learn tons."", 'Good class for Business Communication.  Fun projects, easy papers, valuable information about life after college and healthcare in the real world.  Glad I took this class since it taught me so much more about life outside of the classroom!', 'Very nice teacher. He knows a lot about the subject, very helpful, easy A if you do all of the assignments. Tests are fairly easy and the projects are worthwhile. This is a great class!', 'Great Class, Very informative - Fun and rewarding', 'Pretty good teacher is a Very Valuable class.. learn about all the resume and interview crap your gonna need to know after college..', 'Really nice guy, easy grader', 'I get bad grades but I got an A in this, and he is funny as ****']",4.6,"['average', 'awesome', 'awful', 'awesome', 'awesome', 'awesome', 'awesome', 'awesome', 'awesome', 'awesome', 'awesome', 'awesome', 'awesome', 'awesome', 'awesome', 'awesome', 'awesome']","['3.0', '5.0', '1.0', '4.5', '5.0', '5.0', '5.0', '4.5', '4.5', '5.0', '5.0', '5.0', '5.0', '5.0', '5.0', '5.0', '5.0']"
