,prof,review,rating,emotion,quality
0,https://www.ratemyprofessors.com/professor?tid=84462,"['Great Professor!!!', 'Great lab instructor!  Advice to future students = Follow directions and you will do just fine.', 'Awesome professor! She will break down a hard concept and make it easy to understand. Nicest professor. As long as you are prepared for her labs and turn in assignments ON TIME you will do fine. She knows biology. I would take her again.. no doubt', 'Very enthusiastic and willing to help.', 'Beth Suttles is the best BIO Lab prof that I have had in a long time and she is also the coolest!!!', 'Very down to earth, clear, and reasonable.', 'love Beth.  nice, helpful, and enthusiastic.', ""The only thing that kept me from hating my Earth Science class at BC was Beth's Lab, because God knows the professor and I disagreed about nearly everything."", 'Beth is really awesome. Very helpful & expects you to try & put forth an effort. The lab reports uesd to drive me crazy but I am very appreciative now. It helped me get through the upper level biology & ecololgy courses. She also got me to stop calling myself stupid.', 'she is awesome!', 'Beth is wonderful in every way imaginable! She rocks! I would tell anyone to take her class. She helps you and makes it so much fun! The best lab teacher there, by FAR!', 'Nice person, but dear lordy way too much work!!!!  She is one of those if its not my way, its an F kind of grader.', 'No Comments']",4.4,"['awesome', 'awesome', 'awesome', 'average', 'awesome', 'awesome', 'awesome', 'awesome', 'awesome', 'awesome', 'awesome', 'awful', 'average']","['5.0', '5.0', '4.5', '3.0', '5.0', '4.0', '4.5', '5.0', '5.0', '4.5', '5.0', '2.5', '3.5']"
1,https://www.ratemyprofessors.com/professor?tid=84510,"['Theres a lot to read, it is a 300 level afterall. Do the research, show some interest, go to office hours at least once. You should get a decent grade.', 'He is an amazing professor if you need an advisor.  For an intro class, he was rather a bit boring but the materials he assigned were great - especially for the Africa section of the course.  He is passionate about what he teaches and if you share the same interests as him, he will be the perfect fit!', 'Engaging and interesting prof. Not a subject I am wildly in love with but his classes were definitely memorable!', 'He puts a lot of effort into the ""Africa Problems and Prospects"" seminar-My fav class he teaches. His passion for Africa is infectious, he even jumps out of his chair with excitement. In terms of work, it is relatively light-his focus is more on the discussions and connections that happen in class. On the whole very enjoyable', 'Prof. Kebbede is very nice and devoted to teaching. He is passionate about the material that he is lecturing and very knowledgeable, too. Geog class is very interesting.', ""Very interesting, but very difficult to understand.  I felt like there wasn't any logic to the structure of his lectures.  Tests included stuff we had never heard of."", 'prof kebbede was my abselute favorite teacher at mount holyoke. his lectures were clear and interesting and he was very dedicated to his class. i recomended it to evreyone because he is the very best teacher i ever had', 'horrible.  he took points off my friends exam for saying ""centuries"" instead of 300 years. SO incredibly nitpicky about grading and shouldn\'t be for a 100 level class.  lectures are boring; which is unfortunate since all his quizzes (that he likes to nitpick) are based on his lectures.  bring coffee.  overall? UNBELIEVABLE (in a bad way).', 'Prof Kebbede is such a cutie! How could you people say such ugly things about a man who does star jumps in geography class? STAR JUMPS! He gets really excited about a topic (like Africa) and does a little hop/skip thing that I just love to death. Tests are easy.', 'He is an awesome professor. He is enthusiastic and very passionate about what he lectures. Very accessible outside of class. Knows about Africa and the Middle East inside and out. I recommend him any day!', 'This professor does not know how to lecture.  He says statments like questions, which really annoys me.  He knows the facts, but he does not present them in an interesting manner.  Also, he does not add any of his own insight to lectures.  If at all possible, avoid taking a class with this professor.', ""I love Kebbede! He is very sweet and soo knowledgeable. He answers all questions clearly, willingly and succintly and is an expert on the Middle East. He's so much fun."", ""Very unclear in his teaching, can hardly understand him. Geography could potentially be a very interesting class if it was taught by a different professor. The exam questions he asks are questions he doesn't go over in class. Readings and textbooks are unhelpful. I refuse to take another class with him again."", 'i like him. so long as you talk in class you are cool. he gives a ludicrous amount of reading he never gets through all of it and conversation is rarely about the reading. just ask questions.', ""someone youd want to do research with if youre interested in what he specializes in, because he's very well published and enthusiastic about his subject.  however, he's not an ideal professor because he needs to have higher standards.  his class is pretty easy."", 'says ""actually"" a minimum of 67 times in each lecture. i counted from the second class on and 67 was the lowest count of the semester. nice guy but terrible lecturer.', 'one of the worst classes i took at MHC. learned nothing.', ""Dreaded his class.  doesn't allow creative thought, and if you don't regurgitate exactly what he says in class - word for word - on the exams you will not do well.  What ever happened to that little thing called the individual mind?"", ""he's a nice guy. the class sucks. majorly. don't buy the 100$ book. you don't need to read it EVER because everything on the exams is exactly what he said in class. nothin more and nothin less and you'll get an A. but you have to include EVERYTHING, otherwise, you're screwed."", 'Kebbede himself is a very cool guy, obviously enthusiastic about the subject and very knowledgable as well. If you like lots of memorization, this class is for you cuz the exams are basically exactly what he says in his lectures. Best to just listen, and take notes in class instead of discussing.']",3,"['awesome', 'awesome', 'awesome', 'average', 'awesome', 'awful', 'awesome', 'awful', 'average', 'awesome', 'awful', 'awesome', 'awful', 'awesome', 'awesome', 'awful', 'awful', 'awful', 'awful', 'awesome']","['5.0', '4.5', '5.0', '3.5', '4.5', '2.5', '5.0', '2.0', '3.5', '4.5', '1.0', '5.0', '1.0', '4.0', '4.0', '2.0', '2.5', '1.5', '2.5', '4.0']"
2,https://www.ratemyprofessors.com/professor?tid=84710,"['Does not allow ANY technology at all. Especially in marketing tactics, knowing how to use technology and applications are essential. Instead, he will print what could be on a computer screen. It is not the same in the real work field. He is not a great teacher and requires a lot of self teaching and unfair grading/ workload compared to his efforts.', ""this man tells your absolutely nothing for the tests. He does nothing in class you don't learn anything and when it come around to the test you will have no idea what to study. He is the worst professor in the marketing department do not take him."", ""Yes he has a strange personality and weird sense of humor, yes he's quirky, and it does take a while to get used to. But he is a good guy and despite all the troll-y stuff he says, he does want to see you do well, and he isn't the worst professor by a large margin."", 'His sense of humor is hard to get used to, but overall he was a very fair professor.', ""Dr.Zych is nice but has a strange personality. It took me a while to get to it. I feel like I haven't learned anything this past semester. He expects you to learn everything yourself. It is an okay class to take if you are a marketing or a business administration major."", ""He's a good guy if you can put up with him. He's actually pretty nice but he is really goofy and annoying. 3 fair tests and 1 presentation. He's unclear in his directions but he's easy-going if you put forth effort. You will almost unavoidably gain a nickname from him and he clings to everything you say so choose your words wisely."", ""At first this guy annoyed the heck out of me. He's very quirky. He's a fair grader. He tries to get you to think, so if you don't think you won't do well. If you study for his tests and read the book you'll do fine. I got an A with next to no effort."", 'ANNOYING SENSE OF HUMOR!!! impossible test, and everyword that comes out of this man is sarcastic!!!! do NOT take if possible, will hate going to class if you do', 'nice guy who loves his 80s specs..tests are imopossible but final grade was much better than i expected. annoying sense of humor that u have to get used to.', ""Gives a lot of work, a little too much I think. pretty nice guy and the work he assigns will help in a career which is more than I can say for the majority of classes I've had to take in the business school. Sometimes he overly uses sarcasm which becomes incredibly annoying. Gives a project which is hard but atleast is relevant to a career"", ""Had him for 2 classes. Very good teacher and funny, you'll learn a lot and you'll do work, not too too much though.  actually helps prepare you for a marketing career, if you want to learn anything about marketing at this school you have to take him.  other teachers were of no help to me"", ""Doesn't explain what he wants, doesn't help you with questions and expects a lot from you. There are much better professors to take for marketing"", ""Zych really is the only worthwhile marketing teacher at the U. He makes you work just a little hard, but if you don't mind getting your hand dirty on projects, it's really fun. He always has great marketing examples and a really quirky sense of humor. I wish he tought more classes."", 'No Comments', ""A really nice guy, he wants you to answer your own questions, but isn't really helpful in giving direction.  Still probably the best marketing professor at the U."", 'No Comments', 'Easy tests.  Time consuming projects.  Learn alot from his classes.......sooooooo close.', ""Very nice guy, but sides way too heavy to projects and group work.  Class would be more helpful if it was taught and didn't worry about an end of semester project as much."", 'Quirky sense of humer, but makes you work hard.', 'WEIRD...get out quickly...']",3,"['awful', 'awful', 'average', 'awesome', 'awful', 'average', 'awesome', 'awful', 'average', 'average', 'awesome', 'awful', 'awesome', 'average', 'awful', 'awful', 'average', 'average', 'awesome', 'awful']","['2.0', '1.0', '3.0', '5.0', '1.0', '3.5', '4.0', '2.0', '3.0', '3.5', '5.0', '2.0', '4.0', '3.0', '2.0', '1.0', '3.5', '3.0', '4.5', '2.0']"
3,https://www.ratemyprofessors.com/professor?tid=84805,"[""App Behavioral was a difficult class because he wants you to know a lot verbatim. But for Stats and other psych opinions, he is a gem. He is brilliant and receptive. I never imagined I'd understand Stats to the level that I do still years later. He is very approachable and makes his perception and material intriguing. Love his rants on free will."", ""Yes, salafia is hard, but you will learn more than any other class. He is picky, so just do exactly what he says and you'll be fine. Amazingly smart man, and he is very kind outside of class. He may come off mean, but he's been at Fairfield for 50 plus years."", ""Do not take him. Ever. He will ruin your GPA. He hardly teaches, just reads off of powerpoints, and it's up to you to teach yourself everything. His tests are incredibly difficult, and if it wasn't for the TAs, I would have failed the course."", ""He's the hardest professor I've ever taken. The tests are strictly fill in the blank with some multiple choice. His lectures are just him reading off a ppt, and he's so hard to approach. He's the type to try and make you feel dumb.  If you're a major, don't take L&ABA, take a different required class."", ""OMG one of the toughest teachers at Fairfield U. He def makes you work harder than any other teacher and makes you feel like your failing throughout the whole up until the very end. He's a good teacher but you better be ready to study because it is not an easy class. Took him for STATS as well"", 'READ THE BOOK!!!! He goes over everything in class but everything is meaningless until you read the book beforehand. Tests require a lot of studying, but they are fair for the most part. It is definitely possible to get an A-/A if you read the textbook more than once and memorize his powerpoint slides.', ""Dr. Salafia is very tough and challenges his students to put in a lot of effort.  Read the textbook and you will do very well.  Don't feel intimidated by him either, he is there to help you.  Work hard and focus during lecture and you will be fine.  He curves very fairly."", 'Salafia expects you to learn everything yourself, prior to class. His lessons are unclear and unhelpful for the most part. The best thing you can do is teach yourself, which is no simple task.', ""Really tough class... he forces you to put a lot of effort into your own learning rather than spoon feeding you information for the test.  It was a pain reading the textbook every chapter, but now, after being out of the class for a few months i can honestly say i know a lot more than I've ever learned in any other class."", 'If you do the work and read the textbook before class with notes, you are golden.  Yes he is hard, but if you really apply yourself you will end up with a good grade.  I got an A.', 'He was very interested about topic BUT his lessons are unclear. Thus, you are lost within the class. His tests are fill in, no word bank (very VERY hard). His class is more term based than math itself. Believes students are ""dumb"" because the topic really is just ""child\'s play."" Hard class - GPA will suffer from it. Good luck!', ""This class is very intersting and the books he asks you to get are very helpful Dr. Salafia is very passionate about this subject, but his presentations and class time use is bad. His tests are impossible, study for a week and hopefully you'll get a B. I do not suggest taking him unless your GPA can afford a hit."", 'Dr. Salafia covers a lot of material and is very passionate about his field of study. However, his tests are very hard and your grade is based on three tests and the final. Overall, you still learned a ton of material and despite having a somewhat hard class he is a good teacher.', ""His STATS class is the easiest psych class I've taken. TBH idk how ppl fail it, tho many do. He and TI's tell u wut's on the tests. Do HW and read slides and you should be fine."", ""He is definitely a challenging professor, but at the end of the class, you know your stuff better than you would with anyone else.  I had him for stats and l&aba and I've never worked harder in any class.  He is a genuinely nice person who is always willing to help and talk to students.   Even if he's tough on his students, he always means well"", ""This guy is a joke. Takes stats way too seriously. Strays from the book and makes up his own definitions. Tests focus on his slides which are far more complicated than they should be. Test questions focus on vocab rather than ability to perform statistic tests. Avoid this guy he is clown and won't spend any time to help you."", ""Great teacher. Really nice. Only have 4 tests which are pretty much memorization and if you go to class even easier. Give handouts and study guides which are also helpfull. Your grade is based on the 4 tests. Doesn't penalize you for anything but will bring the grade up if you're borderline and a good student."", ""I had Salafia for BBB,Stats, CL&ABA.While he covers material quickly, his handouts are v.helpful,& he is happy to discuss&clarify any questions.In addition to being brilliant,he is a sweet guy who is genuinely interested in his students' well-being.My fave of the 3 was CL&ABA-not only interesting,but useful for humans (not just psychologists)."", 'Great teacher!!! You only have four tests and he will bring up your grade if its borderline and you are a good student but will not bring it down. The tests are mostly memorization and the lectures are clear and make the tests easier.', ""Great teacher!!! Clear lectures and only 4 tests which are pretty much memorization and easier if you go to class. Doesn't penalize you for anything so that the average of the tests is your final grade but will bring up the grade if you have a borderline grade and are a good student.""]",2.9,"['awesome', 'awesome', 'awful', 'awful', 'awesome', 'average', 'awesome', 'awful', 'awful', 'awesome', 'awful', 'awful', 'awesome', 'awesome', 'awesome', 'awful', 'awesome', 'awesome', 'awesome', 'awesome']","['5.0', '5.0', '1.0', '1.0', '4.0', '3.0', '4.0', '1.5', '2.5', '4.5', '1.5', '2.5', '4.0', '4.0', '4.5', '1.5', '4.0', '5.0', '4.5', '4.0']"
4,https://www.ratemyprofessors.com/professor?tid=85032,"['Mrs. Cox is a very good teacher!', 'She is a very boring professor but she cares a ton about her students . She will make sure every student does well on their essay . She goes one by one to each student and reads over their essay draft and tell them what they should correct . She is  very helpful !', 'Very nice! Loved her class. I had her for comp 1 and 2. If you need help go see her! Shes very helpful and understanding. If youre just shy of a letter grade she will not bump you a grade but will help you figure out what you need to do to get that grade. Great class!', ""Cox is a nice teacher. I would recommend her. She seems to prefer dry writing with an emphasis on good grammar rather than actual content and a paper full of great ideas. I enjoyed all of the stories and poetry that we covered. It was a good class. It's not too hard, but u have to learn quickly how she wants you to write your papers."", 'Her class is generally fair and not a hard work load. Come to class if you want to be on good terms with her. She is a little rigid and knows what she wants. Not the most friendly but I learned a lot about grammer.Our class had fun disscussions as well. But when it came to poetry it was a little more fast paced and writing was tough.', ""She does not grade fairly at all. Her nephew and his friends were in my class and of course they all got A's and were treated as favorites. They even joked about how well they had it made. I had another English teacher review my essays after receiving D's & C's.  He completely disagreed with her grading and agreed she is a hypocrite and not fair."", ""As long as you do your projects and turn in the work, it is an easy class.  The hardest part is the essays, but there isn't too many and they aren't long ones."", ""Don't take her! I had her for comp 1 and shes some what easy but she doesn't grade the essays fair, AT ALL!"", ""She tells you what she wants but if she doesn't like your writing style your screwed"", ""This class was supposed to get you oriented to life at Tech. It didn't. She is a hypocrite. She would talk on her cell phone while writing ABSOLUTELY NO CELL PHONES on the board. She clearly thinks she is better than her students. She is rude and mean. Avoid!"", ""I had Mrs. Nancy for both Comp 1 and 2. She is a great teacher and really helps you understand what you need to know. Her class can get boring at times but it's english! KEEP THE CELL PHONES PUT UP! She grades harder on her essays for Comp 1 than she does for Comp 2. She isn't strict about attendance."", ""I really liked having Mrs. Cox as a teacher. She really wants every student to do well. Some lecture days seem really long..but that's normal. It is an easy A if you do all the work."", ""I loved this class! Mrs. Cox is very clear and tells you exactly what is expected. She's very helpful and wants you to do well. Very sweet lady! She has high standards and will kick you out of class if she catches you with your phone out, but as long as you do your homework and follow her instuctions it's a very straightforward class."", 'She makes what she wants from you very clear. If you are having problems not understanding she will gladly help you. She truly wants everyone to pass her class unlike many professors. She will know your capabilities and she will make you live up to them. She has made me a better writer overall.', ""I didn't like this class at all.  I didn't think she graded essays fair and she wouldn't help and tell you what you did wrong on them.  I would drop this class if you have her!"", 'She is a good teacher. Her grading is a little hard, but she is fair. She helps you to understand what you are reading and is very concerned if her students do well.', ""i would recommend taking this teacher for Comp 1. You have 6 essays to write, but they aren't that hard. You do quite a bit of grammar work but none of it is difficult. She really cares about her students and is willing to help you out however she can."", 'I did not like her class.  Their are six essays, 12 presentations, two poetry journals, and two short story journals.  I would suggest Dr. Lake for Comp.2', 'shes really nice. greads hard. She is willing to help you get better greads on papers.', ""On the essays she is pretty tough on grading, but homework grades are very easy points. Every grammar quiz we took in a group of four people. She's very clear about what she wants from you on the essay assignments.""]",4,"['awesome', 'awesome', 'awesome', 'awesome', 'awful', 'awful', 'awesome', 'average', 'awesome', 'awful', 'awesome', 'awesome', 'awesome', 'awesome', 'awful', 'awesome', 'awesome', 'awful', 'awesome', 'awesome']","['5.0', '5.0', '4.0', '4.0', '2.0', '1.0', '4.5', '3.5', '4.0', '2.0', '5.0', '5.0', '5.0', '4.0', '2.0', '5.0', '4.0', '2.5', '5.0', '5.0']"
