,prof,review,rating,emotion,quality
5,https://www.ratemyprofessors.com/professor?tid=85105,"['If you want to actually learn from a professor with real, diverse experience with large brands and a massive network to connect with, take her. Is it a hard class? Yes. But I feel like I grew a ton and have a much deeper understanding of good advertising. Cant handle criticism? Good luck in your career.', 'Literally horrible. So disrespectful and not professional. Wont reply to emails, huge ego. The class is all tests and one group project. Tests are purposely made to be tricky. Every presentation was interrupted and critiqued right in front of the whole class instead of in a separate format. I could go on forever about her, not enough characters!', 'Do not take her. Non consistent grading criteria and seems to never be happy with any work. Really really makes you work for a good grade, and even if she somewhat likes your work, she picks it apart and makes you feel bad about your work. Only take her if you want to be on ad team. Very difficult person and grader.', ""I normally don't write reviews, but this one is necessary. Do not take her if you can help it. It seems as though she makes up what she wants to talk about in lecture as she goes because it doesn't follow the syllabus whatsoever. Her grading is harsh and feedback is not helpful. Doesn't answer questions or emails. Makes fun of students."", 'Melissa Burnett is one of the worst professors I have had. Her lectures are pointless, she promises bonus points that are never given and she gives unhelpful feedback. I would never take her again.', 'Assigns unorganized work and seems to fly by the seat of her pants. Learned a lot about creative advertising, but no matter what your opinion is, hers is always superior.', ""Very cool professor. Project based class. Has tons of real world experience/advice so I really feel I'm learning valuable stuff. Don't need a book but expect to spend some of that money on project materials. No tests. Get on her good side because she picks ad team members."", ""one of the best teachers i've had at MSU. covers a lot of test material in class so be sure to go. got an A without the book! "", ""Best professor I've had. Genuinely cares about students and pushes us to our full potential. People hate on her a lot because they can't handle criticism. I learned so much about how to create great advertising. If you want a career in the advertising industry, take this class! But if you dont, do not take this class because it's a lot of work. "", ""Dr. Burnett is a fantastic instructor.  She is very enthusiastic and knowledgeable. However, if you don't come to class you will miss a lot of the information for tests! TIP: Print your slides before class and take notes! It will be an easy A for you if you pay attention, study notes, come to class. Book is not mandatory but helpful before exams!!"", ""This is by far the worst professor I've ever had. She's a bully, plays her favorites, and expects you to drop EVERYTHING for her class. Do not take her if you have any interest in Advertising, she'll make you hate it. Creative is not about making creative ads, it's an event planning class where she shoves her personal agenda down your throat."", ""She means well, but can't keep herself organized. She has too much going on with Ad Team and her grad class. She wants you to work extremely hard and gives hardly any points. Her class is frustrating, although she is very enthusiastic and wants her students to do well."", 'Unless you go and talk to her or are on ad team, you are SCREWED', 'Do not take this class unless you absolutely must! She teaches NOTHING and expects you to learn by trial and error, while recieving poor grades at the same time. I spent HOURS on projects to later learn that we got absolutely NO CREDIT for them. Some of them got an occasional 10 points. Join Ad team and you might have a chance at an A in the class', 'Not a bad class.  Just go to class.  Reviews are not very clear but just study the online quizes.  Also if your in class you get easy quiz points.  An easy B for sure.', 'She is a great professor, study power points for tests and you will do ok.  Pretty funny, likes to keep class entertained.  Just a couple of tests and final.  Likes to give bonus points on Fridays!!', ""She is really one of the best teachers I've had. When it comes to getting a job, she is hard on you so that you learn and can really make in the real world. I now have a job, and I learned so much from her. Plus one of the reasons she works you so hard is so that you have respectable examples that are necessary for getting a job."", ""Awful class.  Don't expect to get any points for effort.  Grades only on the final product.  Go suck up ALL SEMESTER in her office hours and it will improve your grade.  Overly Critical by far and it has NOTHING to do with being LAZY-it has everything to do with how much you kiss up-COMPLETELY SUBJECTIVE-NO TESTS. You get what she gives you."", ""Burnett is by far the worst teacher I have EVER had. She is completely condesending and has an awful personality. I've always been an A student, and I'm getting a C in this class. She doesnt TEACH anything. She tells you to try to do it then makes you stand in front of the class and tells everyone that she hates everything you did. Don't take her!"", 'Well, if you think you like advertising, take this class to change your mind. Be ready to hear the terms ""dinked this up"" (as said before) and ""good concept. develop it more"" about 1000 times. Thank you Burnett for making me NOT want to do this anymore.']",2.7,"['awesome', 'awful', 'awful', 'awful', 'awful', 'awful', 'awesome', 'awesome', 'awesome', 'awesome', 'awful', 'awful', 'awful', 'awful', 'average', 'awesome', 'awesome', 'awful', 'awful', 'awful']","['4.0', '1.0', '1.0', '1.0', '1.0', '2.0', '5.0', '5.0', '5.0', '5.0', '1.0', '2.0', '2.5', '1.5', '3.0', '4.5', '5.0', '1.5', '1.0', '2.0']"
6,https://www.ratemyprofessors.com/professor?tid=85187,"['I took his Logic class and it was terribly boring.  He\'s a nice guy but the class is awful.  There is no reason a class should be that boring.  If I hear another example of ""If it\'s raining, then the streets are wet""...I\'m going to kill myself.', ""Made a B on first test next test came after drop and i mad F's on both i'm a junior and before this class Two C's were my lowest grades so you be the judge and very boring!"", ""Hardest 100 level class I have ever taken. Made a high B on the first test but drop date came before last two tests. SO I failed the next test and ultimately the class becuase i didnt understand the material. He trapped me. I thought I would be ok but the difficulty trippled and I couldn't get out. Would have dropped if i coould have!! Only F ever!"", ""He's the best!"", 'Took that a few years ago and the only thing I learned is...""If it\'s raining, then the streets are wet"" R U W   haha', 'No Comments', ""Very boring and not clear at all.  The only F i have made in my entire life. I took finite the next semester and logic is the first 4 chapters and made A's on all those tests.  He was teaching the class like everybody already knew how to do it."", 'really laid back, cool stuff', ""He's hard, boring, and unclear. According to people had have taken him way back in he has been using the same stuff for 15 years at least. Words change into symbols out of no where without explaination of what the heck is going on. 2 tests after drop date caused me get my only F at south, Its raining and the streets are wet..."", 'its not that he is a bad teacher but the jerk gave 3 test the entire semester the last 2 after the drop date so i had an A before test 2 then one mistake and now im stuck with a bad grade that not fair...', ""I hate when people blame Dr. B for the difficulty of his courses. It's logic wtf do u expect? Try going to an SI session before you complain loser! Baldwin encourages you to come to him for help  outside of class, he's very funny and mmmmm sexy salty goodness boy does he look nice in jeans!"", 'Great instructor.Material is slightly difficult but attend class, take notes and read assignments and you will pass with ease. He amkes me want to switch majors just to have more classes from him...""old but sexy""', 'Dr. Baldwin teaches a difficult class with ease and intellect. His tests can be very hard but his lectures cover the material pretty well.', 'Good teacher...take Finite Math the same semester you take this class, it will help...tests are easy as long as you come to class and take notes...do NOT take attendence lightly in this class...only problem with him is that he has favorites', 'Very methodical approach to presenting the material.  Very fair test grading.', 'Does not prepare for class, even upper division classes.  Abstruse ""explanations.""', 'I found him to be very fair to his students. Do not take his symbolic logic class without intro first.', ""Good teacher, very thorough.  Don't blame him for the difficulty of his logic classes.  Can be a little aloof and demanding, but one of my fav teachers"", 'He is very monotone. However, his tests are fair.', 'No Comments']",3.5,"['awful', 'awesome', 'awful', 'awesome', 'average', 'average', 'awful', 'awesome', 'awful', 'awful', 'awesome', 'awesome', 'awesome', 'average', 'average', 'awful', 'awesome', 'awesome', 'average', 'awful']","['2.5', '4.5', '2.0', '5.0', '3.5', '3.5', '1.0', '4.0', '1.0', '2.0', '5.0', '5.0', '4.5', '3.5', '3.5', '2.0', '4.5', '4.0', '3.5', '1.0']"
7,https://www.ratemyprofessors.com/professor?tid=85428,"['McKnight is incredibly unapproachable and his tests are significantly harder than the other 213 professors. Everything is free response, which means you must know the material 130%. He has a huge ego and will dismiss you if you ask any sort of question to him. He teaches as if we all know the material beforehand and does not explain well at all.', 'Dr. Mcknight is such a hard professor. His tests are weirdly worded and he expects us to know it all and beyond that. Word for word. He is totally NOT approachable. I went once to go talk to him and he completely blew me off. I would not take him again.', ""McKnight is not easy by any means, but I feel that he is being judged too harshly on here. His lectures aren't too dry, and he really desires interactions from students. He's a very smart guy and is passionate. Work hard, and go to class. If you work hard enough to get an A, you'll probably get a B. It's a weed out class, that's how it works."", ""Do NOT take this professor. I studied, went to class, did the book objectives and went to outside tutorials and I still failed his tests! His tests are so hard and don't match up with his lectures at all! you have to really read the book and fully comprehend everything to be able to do good in his class."", ""his test were really hard, they didnt seem to come from the book or lecture. i could study for days and still fail every test. he gets off subject in his lectures which makes it hard to pay attention to. if you must take bio at TAMU, do NOT take McKnight...you'll be sorry if you do."", 'Terrible professor. Exams are neither from the book nor the lecture. Cannot stay on topic and refuses to answer questions he considers ""too basic"". Told our class that failing exam meant we were not intelligent enough for college but over half the class failed. If you must take Bio at TAMU, do not take from McKnght.', ""Biology in general is very hard at A&M. Take it somewhere else. This prof in general like the others is hard and only 10-15% will make A's. He does not know how to teach and attending class is pointless. Study and memorize the book. Tests are quite difficult but he'll curve the class in the end. If you have an 87+ you'll  probably make an A."", ""He tries to explain things but you can't ask a question about EVERYTHING he says. A LOT of it is up to you, and the SIs for his class don't help"", 'Do NOT, I repeat, DO NOT take this professor. His exams are based on the ""best answer"" when he gives you at least 2 solid good answers...so basically you\'ll never get an A. He feels entitled because he\'s been a professor for so long. Run away now while you still can.', ""Exams don't match up with lectures at all! 40 mult. choice questions. Reading the book isn't required, but you should."", 'Tests were not over the lecture just make sure that you read and study the learning objectives from every angle possible. Was extremely boring in lecture and goes off on tangents!', 'You cant hear him if your sitting not sitting very close and he says ""uhh"" after every word which makes it difficult to concentrate on anything but that.', ""He was a very good prof.  He really understood the material, taught the material really well, and always answered questions.  He's easy to get a hold of.  His tests aren't too difficult if you read the material and pay attention in the lectures and during the lab."", ""HE'S test were HARD!!! Didn't match up with the lectures."", ""The class lectures and the tests didn't really coincide. The exams were all essay with only 10-15 questions. The final was the only thing that saved this class."", ""tests were graded very inconsistently and were not representative of material taught in the course, although I use the word taught loosely.  Dr. McKnight's lectures generally consist of him standing in front of the class reading off of overheads."", 'No Comments']",2,"['awful', 'awful', 'awesome', 'awful', 'awful', 'awful', 'awful', 'awful', 'awful', 'awful', 'awful', 'awful', 'awesome', 'awful', 'awful', 'awful', 'awful']","['1.0', '1.0', '4.0', '2.0', '1.5', '1.0', '2.0', '2.0', '2.0', '2.0', '1.5', '2.0', '5.0', '1.5', '1.5', '1.0', '1.0']"
8,https://www.ratemyprofessors.com/professor?tid=85461,"['Lectures were unorganized, powerpoints make it hard to take notes. If you can switch over to Reed, do that. Use your voice memo app on your phone to record his run-through the day before exams, theyre really your only grades.', 'His demeanor is very rude. He is unapproachable and generally has a very grumpy attitude. He does not answer questions with any degree of clarity and spends most of class telling stories. He does not understand technology very well, and his tests are often filled with errors. Reviews for the exams are useless. Avoid taking him.', 'Has loads of experience. The work can be hard but helps to prepare for more difficult work.', 'Randomly assigns grades and cannot explain what he marks off on assignments. ', 'Old Pro. Knows his facts because he has been there and done that for many years. Wants you to ""know about"" a wide range of information, but clearly identifies what will be tested on. Reads every question on the exam for review. Not a good test maker so some credit may be given back for poorly phrased questions or multiple correct answers.', 'He is amazing and I am so glad he is the chair of geology! So funny, and wants you to understand the material. Love Love Love!', 'Boring, boring, boring. Picks favorites and least favorite students and acts accordingly the whole semester. Random lectures - unorganized and (did I say) boring!', 'Awesome professor, loved the class, learned so much, take him!', ""All he does is tell stories about his family trips and he will pick on the same person every day. never follows outline.  The class before the test he brings the test in and reads it to you.  bring a recorder because that's the only time you'll hear whats on the test.  Nielson gives quizzes when not enough people show up to class."", 'Yes, I have literally taken every single one of Nielsons classes. He is the easiest geology professor you could ever take. N. Am., Geomorph, Paleo & his part of Petrology are easy. Go to class & sit thru lecture. Strat no matter what the whiners say is CHALLENGING! Know that going in. Dont leave work til last min then **** about it. Easy Bs and As', ""His lecture is very random. He has an outline, but doesn't follow it. Very hard to follow. His review doesn't really help that much, he goes through it very fast and a lot of the info isn't in the book. He makes the test harder than they need to be with trick questions. He is a nice guy and tells good stories. Pretty hard class"", 'Dr. Nielson is great. Come to class. Listen. Bring a recorder for review days . Take the test...argue points back! He is funny and always willing to help!', ""Who doesn't like geology?!  Fun class!  Teacher will pick favorates and tell you one thing and do something completly different.  I will take any geology class as long as it's not with Dr. Neilson!!"", 'This was a fun field trip. I made an easy A. It was VERY windy and rainy when I went but I still had a great time. He explains things well and is easy to understand.', 'Fun class - take it if you are a geology major', ""Great guy, great teacher, don't get caught in his duck blind on test day!!!!"", 'My favorite professor!!! Very knowledgeable, kind, and a great person. Helpful out of class, and almost always in his office.  Really is a great guy to take for any class.', ""Fun class. Told lots of stories that help you understand the concepts he's teaching. He will literally tell you all of the question on the exam before you take it. Made an A."", 'good teacher', 'plan on attending classes on fridays...he gives attendance quizes. this class is easy but the lab will absolutely kill you.']",3.8,"['average', 'awful', 'awesome', 'awful', 'average', 'awesome', 'average', 'awesome', 'awful', 'awesome', 'average', 'awesome', 'awful', 'awesome', 'awesome', 'awesome', 'awesome', 'awesome', 'awesome', 'average']","['3.0', '1.0', '4.5', '1.0', '3.5', '5.0', '3.0', '4.5', '2.0', '5.0', '3.0', '5.0', '1.0', '5.0', '5.0', '5.0', '5.0', '5.0', '4.5', '3.0']"
9,https://www.ratemyprofessors.com/professor?tid=85682,"['He may get offtrack some times but this class is an easy A if you show up, read the books and do the study guide. and remeber you gotta catch em all, pokemon!', 'Mr. Hammes is a great teacher. this course by itself is not easy but he makes the content simple to comprehend. he does not leave any homework but there are 2 midterms, one for each half of the whole semester & since it is a lot of content he lets you use open notes for each test since the content of the class can be tricky.', ""Goes on random tangents all the time, his tests are using the book all the time.Pretty easy to pass if you don't fall asleep in class. Most people failed the first test, so he added +15 points on their tests, but since I actually passed the test, he didn't add the points onto mine. Fairness level,not so much."", ""Yes he does go on random tangents at times... but at least he relates the material to the real world so that students can understand it better.  His expectations are very clear, read, pay attention and you will do fine!  I learned a lot in his class and found it so interesting!  But I also am a Poli Sci major... Not everyone's cup of tea"", 'Very difficult teacher!! Hands out 10 pg study guide for all tests, really hard to study for. Boring lectures, goes off topic often and tests are VERY hard!!!', ""He is awesome. Ys he talks alot about other stuff like his wife and his sun or etc but he is really good at what he teaches. Do the readings and take notes and you'll be fine."", ""Took Comparative Politics. This is a class that emphasizes comparisons and he tends to reward those with thoughts, even if they're contrary to his. If you attend and take notes you'll do fine.  He does talk a lot of liberal bologna, but doesn't shut down discussion or disagreement. He's a good teacher, and he cares - especially if students care."", ""WORST TEACHER EVER. he just talks about his wife, the marines and whatever else he feels like for the hour and a half you have to be there. He's the reason I switched my major. I don't suggest taking his class."", 'Hate personality but class is easy to get a B in & if you try hard, you can easily get an A. No HW. 3 tests. 1st- 1/2 multiple choice/ 1/2 short answer, w/ 1 pg of notes. Last 2- essay only, w/ all your notes. Tells you the 2 possible topics. Adds 7 pts to your score. Goes through Power Pt quickly, so bring computer. Conservatives need thick skin.', ""show up, take notes, especially just before test days & you will pass. I'm passing so far & its not taking much effort. but his lectures are painful. he's a typical CA liberal, continuously expressing his disgust w/ anyone who isn't him. oh- & he's still hung up on his 6 glorious yrs in the USMC 40yrs ago."", 'He made his political stance very clear on the first day and continued to mock those who oppose his view throughout the semester.  Other than that, he talked a whole lot about his his wife, his daughter, woodworking and his honorable days in the Vietnam War.  I taught myself the entire course.  Are you willing to do the same?', ""This professor was very entertaining.  He is very intelligent and doesn't choose one side of the political spectrum.  He argues both sides and makes you really think about your political views.  If you read the book and go to class youre golden."", 'Captian Hammes is a former Marine. If YOU are a Marine then I would HIGHLY recommend him! Sit near the front! He loves to swap war stories and he is a very carrying teacher!! He truly does care and help the students! He GIVES you the notes!', 'I was very disappointed with this class and the instructor. His teaching lacks structure and positive attitude.', ""Please try to stay away from this professor. He is the most horrible professor you can find for political science. He doesn't let students to talk. He just talk himself for the entire class period without even asking questions or answering students questions. And most of his talking is useless, because he doesn't talk about what will be on the exam"", 'As other people have said,want to learn the subject and get a good grade? dont take him. He makes class fun, but when u get your scores back its not so fun. he rushes over things so he can tell you about the marines, his wife, or how much the government sucks, as if we havnt heard about how bad the republicans are from every poli sci class ever!', 'I went to class 5 times and got a B. Just get the study guides off his online site page and show up for the tests. He though I was cheating, I told him his class was too easy. He laughed. Seriously, figure it out people.', 'not hard but not easy.too much reading and talks way too much about random stuff. needs to talk more about poli sci and less about marines and wife.funny though', 'If you want to learn something or get a good grade then NEVER take this guy. If you want to get a poor grade and learn about his wife, his son, his wife, ex-wife, Marine corps, and his wood-working days then take this guy.', ""Good Prof. Yes he talks about random things, this made the class more interesting. He tries to make students think. Good for him. I wish more classes were like his. I'm busy and don't study as much as I should and still managed to get an A. More importantly I learned a lot. What an asset. I wish I had taken him for more of my Poli Sci classes.""]",3.2,"['awesome', 'awesome', 'awful', 'awesome', 'awful', 'awesome', 'awesome', 'awful', 'average', 'awful', 'awful', 'awesome', 'awesome', 'awful', 'awful', 'awful', 'awful', 'awesome', 'awful', 'awesome']","['4.0', '4.5', '2.0', '4.5', '2.0', '5.0', '4.5', '2.0', '3.5', '2.5', '1.5', '4.0', '5.0', '1.5', '1.0', '2.0', '1.5', '4.5', '1.5', '5.0']"
